#	CVE ID	CWE ID	# of Exploits	Vulnerability Type(s)	Publish Date	Update Date	Score	Gained Access Level	Access	Complexity	Authentication	Conf.	Integ.	Avail.
951	CVE-2009-3388	399		DoS Exec Code	2009-12-17	2017-09-18	9.3	None	Remote	Medium	Not required	Complete	Complete	Complete	liboggplay in Mozilla Firefox 3.5.x before 3.5.6 and SeaMonkey before 2.0.1 might allow context-dependent attackers to cause a denial of service (application crash) or execute arbitrary code via unspecified vectors, related to "memory safety issues."
952	CVE-2009-3383			DoS Exec Code Mem. Corr.	2009-10-29	2017-09-18	10.0	None	Remote	Low	Not required	Complete	Complete	Complete	Multiple unspecified vulnerabilities in the JavaScript engine in Mozilla Firefox 3.5.x before 3.5.4 allow remote attackers to cause a denial of service (memory corruption and application crash) or possibly execute arbitrary code via unknown vectors.
953	CVE-2009-3382			DoS Exec Code Mem. Corr.	2009-10-29	2017-09-18	10.0	None	Remote	Low	Not required	Complete	Complete	Complete	layout/base/nsCSSFrameConstructor.cpp in the browser engine in Mozilla Firefox 3.0.x before 3.0.15 does not properly handle first-letter frames, which allows remote attackers to cause a denial of service (memory corruption and application crash) or possibly execute arbitrary code via unspecified vectors.
954	CVE-2009-3381			DoS Exec Code Mem. Corr.	2009-10-29	2017-09-18	10.0	None	Remote	Low	Not required	Complete	Complete	Complete	Multiple unspecified vulnerabilities in the browser engine in Mozilla Firefox 3.5.x before 3.5.4 allow remote attackers to cause a denial of service (memory corruption and application crash) or possibly execute arbitrary code via unknown vectors.
955	CVE-2009-3380			DoS Exec Code Mem. Corr.	2009-10-29	2017-09-18	10.0	None	Remote	Low	Not required	Complete	Complete	Complete	Multiple unspecified vulnerabilities in the browser engine in Mozilla Firefox 3.0.x before 3.0.15 and 3.5.x before 3.5.4 allow remote attackers to cause a denial of service (memory corruption and application crash) or possibly execute arbitrary code via unknown vectors.
956	CVE-2009-3379			DoS Exec Code	2009-10-29	2017-09-18	10.0	None	Remote	Low	Not required	Complete	Complete	Complete	Multiple unspecified vulnerabilities in libvorbis, as used in Mozilla Firefox 3.5.x before 3.5.4, allow remote attackers to cause a denial of service (application crash) or possibly execute arbitrary code via unknown vectors. NOTE: this might overlap CVE-2009-2663.
957	CVE-2009-3378			DoS Exec Code	2009-10-29	2017-09-18	9.3	None	Remote	Medium	Not required	Complete	Complete	Complete	The oggplay_data_handle_theora_frame function in media/liboggplay/src/liboggplay/oggplay_data.c in liboggplay, as used in Mozilla Firefox 3.5.x before 3.5.4, attempts to reuse an earlier frame data structure upon encountering a decoding error for the first frame, which allows remote attackers to cause a denial of service (NULL pointer dereference and application crash) or possibly execute arbitrary code via a crafted .ogg video file.
958	CVE-2009-3377			DoS Exec Code	2009-10-29	2017-09-18	10.0	None	Remote	Low	Not required	Complete	Complete	Complete	Multiple unspecified vulnerabilities in liboggz before cf5feeaab69b05e24, as used in Mozilla Firefox 3.5.x before 3.5.4, allow remote attackers to cause a denial of service (application crash) or possibly execute arbitrary code via unknown vectors.
959	CVE-2009-3376	16			2009-10-29	2017-09-18	9.3	None	Remote	Medium	Not required	Complete	Complete	Complete	Mozilla Firefox before 3.0.15 and 3.5.x before 3.5.4, and SeaMonkey before 2.0, does not properly handle a right-to-left override (aka RLO or U+202E) Unicode character in a download filename, which allows remote attackers to spoof file extensions via a crafted filename, as demonstrated by displaying a non-executable extension for an executable file.
960	CVE-2009-3375	264		Bypass	2009-10-29	2017-09-18	4.3	None	Remote	Medium	Not required	Partial	None	None	content/html/document/src/nsHTMLDocument.cpp in Mozilla Firefox 3.0.x before 3.0.15 and 3.5.x before 3.5.4 allows user-assisted remote attackers to bypass the Same Origin Policy and read an arbitrary content selection via the document.getSelection function.
961	CVE-2009-3374	264		Exec Code	2009-10-29	2017-09-18	7.5	None	Remote	Low	Not required	Partial	Partial	Partial	The XPCVariant::VariantDataToJS function in the XPCOM implementation in Mozilla Firefox 3.0.x before 3.0.15 and 3.5.x before 3.5.4 does not enforce intended restrictions on interaction between chrome privileged code and objects obtained from remote web sites, which allows remote attackers to execute arbitrary JavaScript with chrome privileges via unspecified method calls, related to "doubly-wrapped objects."
962	CVE-2009-3373	119		Exec Code Overflow	2009-10-29	2017-09-18	10.0	None	Remote	Low	Not required	Complete	Complete	Complete	Heap-based buffer overflow in the GIF image parser in Mozilla Firefox before 3.0.15 and 3.5.x before 3.5.4, and SeaMonkey before 2.0, allows remote attackers to execute arbitrary code via unspecified vectors.
963	CVE-2009-3372			Exec Code	2009-10-29	2017-09-18	9.3	None	Remote	Medium	Not required	Complete	Complete	Complete	Mozilla Firefox before 3.0.15 and 3.5.x before 3.5.4, and SeaMonkey before 2.0, allows remote attackers to execute arbitrary code via a crafted regular expression in a Proxy Auto-configuration (PAC) file.
964	CVE-2009-3371	399		DoS Exec Code	2009-10-29	2017-09-18	10.0	None	Remote	Low	Not required	Complete	Complete	Complete	Use-after-free vulnerability in Mozilla Firefox 3.5.x before 3.5.4 allows remote attackers to cause a denial of service (application crash) or possibly execute arbitrary code by creating JavaScript web-workers recursively.
965	CVE-2009-3370				2009-10-29	2017-09-18	5.0	None	Remote	Low	Not required	Partial	None	None	Mozilla Firefox before 3.0.15, and 3.5.x before 3.5.4, allows remote attackers to read form history by forging mouse and keyboard events that leverage the auto-fill feature to populate form fields, in an attacker-readable form, with history entries.
966	CVE-2009-3274				2009-09-21	2017-09-18	4.4	None	Local	Medium	Not required	Partial	Partial	Partial	Mozilla Firefox 3.6a1, 3.5.3, 3.5.2, and earlier 3.5.x versions, and 3.0.14 and earlier 2.x and 3.x versions, on Linux uses a predictable /tmp pathname for files selected from the Downloads window, which allows local users to replace an arbitrary downloaded file by placing a file in a /tmp location before the download occurs, related to the Download Manager component. NOTE: some of these details are obtained from third party information.
967	CVE-2009-3079	94			2009-09-10	2017-09-18	10.0	Admin	Remote	Low	Not required	Complete	Complete	Complete	Unspecified vulnerability in Mozilla Firefox before 3.0.14, and 3.5.x before 3.5.3, allows remote attackers to execute arbitrary JavaScript with chrome privileges via vectors involving an object, the FeedWriter, and the BrowserFeedWriter.
968	CVE-2009-3078	20			2009-09-10	2017-09-18	5.0	None	Remote	Low	Not required	None	Partial	None	Visual truncation vulnerability in Mozilla Firefox before 3.0.14, and 3.5.x before 3.5.3, allows remote attackers to trigger a vertical scroll and spoof URLs via unspecified Unicode characters with a tall line-height property.
969	CVE-2009-3077	94		Exec Code	2009-09-10	2017-09-18	9.3	Admin	Remote	Medium	Not required	Complete	Complete	Complete	Mozilla Firefox before 3.0.14, and 3.5.x before 3.5.3, does not properly manage pointers for the columns (aka TreeColumns) of a XUL tree element, which allows remote attackers to execute arbitrary code via a crafted HTML document, related to a "dangling pointer vulnerability."
970	CVE-2009-3076				2009-09-10	2017-09-18	9.3	Admin	Remote	Medium	Not required	Complete	Complete	Complete	Mozilla Firefox before 3.0.14 does not properly implement certain dialogs associated with the (1) pkcs11.addmodule and (2) pkcs11.deletemodule operations, which makes it easier for remote attackers to trick a user into installing or removing an arbitrary PKCS11 module.
971	CVE-2009-3075			DoS Exec Code Mem. Corr.	2009-09-10	2017-09-18	10.0	Admin	Remote	Low	Not required	Complete	Complete	Complete	Multiple unspecified vulnerabilities in the JavaScript engine in Mozilla Firefox before 3.0.14 and 3.5.x before 3.5.2, Thunderbird before 2.0.0.24, and SeaMonkey before 1.1.19 allow remote attackers to cause a denial of service (memory corruption and application crash) or possibly execute arbitrary code via vectors related to use of mutable strings in the js_StringReplaceHelper function in js/src/jsstr.cpp, and unknown vectors.
972	CVE-2009-3074			DoS Exec Code Mem. Corr.	2009-09-10	2017-09-18	10.0	Admin	Remote	Low	Not required	Complete	Complete	Complete	Unspecified vulnerability in the JavaScript engine in Mozilla Firefox before 3.0.14 allows remote attackers to cause a denial of service (memory corruption and application crash) or possibly execute arbitrary code via unknown vectors.
973	CVE-2009-3073			DoS Exec Code Mem. Corr.	2009-09-10	2017-09-18	10.0	None	Remote	Low	Not required	Complete	Complete	Complete	Unspecified vulnerability in the JavaScript engine in Mozilla Firefox 3.5.x before 3.5.3 allows remote attackers to cause a denial of service (memory corruption and application crash) or possibly execute arbitrary code via unknown vectors.
974	CVE-2009-3072			DoS Exec Code Mem. Corr.	2009-09-10	2017-09-18	10.0	Admin	Remote	Low	Not required	Complete	Complete	Complete	Multiple unspecified vulnerabilities in the browser engine in Mozilla Firefox before 3.0.14 and 3.5.x before 3.5.3, Thunderbird before 2.0.0.24, and SeaMonkey before 1.1.19 allow remote attackers to cause a denial of service (memory corruption and application crash) or possibly execute arbitrary code via vectors related to the BinHex decoder in netwerk/streamconv/converters/nsBinHexDecoder.cpp, and unknown vectors.
975	CVE-2009-3071			DoS Exec Code Mem. Corr.	2009-09-10	2017-09-18	10.0	Admin	Remote	Low	Not required	Complete	Complete	Complete	Multiple unspecified vulnerabilities in the browser engine in Mozilla Firefox before 3.0.14, and 3.5.x before 3.5.2, allow remote attackers to cause a denial of service (memory corruption and application crash) or possibly execute arbitrary code via unknown vectors.
976	CVE-2009-3070			DoS Exec Code Mem. Corr.	2009-09-10	2017-09-18	10.0	Admin	Remote	Low	Not required	Complete	Complete	Complete	Multiple unspecified vulnerabilities in the browser engine in Mozilla Firefox before 3.0.14 allow remote attackers to cause a denial of service (memory corruption and application crash) or possibly execute arbitrary code via unknown vectors.
977	CVE-2009-3069			DoS Exec Code Mem. Corr.	2009-09-10	2017-09-18	10.0	Admin	Remote	Low	Not required	Complete	Complete	Complete	Unspecified vulnerability in the browser engine in Mozilla Firefox 3.5.x before 3.5.3 allows remote attackers to cause a denial of service (memory corruption and application crash) or possibly execute arbitrary code via unknown vectors.
978	CVE-2009-3014	79		XSS	2009-08-31	2017-08-16	4.3	None	Remote	Medium	Not required	None	Partial	None	Mozilla Firefox 3.0.13 and earlier, 3.5, 3.6 a1 pre, and 3.7 a1 pre; SeaMonkey 1.1.17; and Mozilla 1.7.x and earlier do not properly handle javascript: URIs in HTML links within 302 error documents sent from web servers, which allows user-assisted remote attackers to conduct cross-site scripting (XSS) attacks via vectors related to (1) injecting a Location HTTP response header or (2) specifying the content of a Location HTTP response header.
979	CVE-2009-3012	79		XSS	2009-08-31	2009-09-01	4.3	None	Remote	Medium	Not required	None	Partial	None	Mozilla Firefox 3.0.13 and earlier, 3.5, 3.6 a1 pre, and 3.7 a1 pre does not properly block data: URIs in Location headers in HTTP responses, which allows remote attackers to conduct cross-site scripting (XSS) attacks via vectors related to (1) injecting a Location header that contains JavaScript sequences in a data:text/html URI or (2) entering a data:text/html URI with JavaScript sequences when specifying the content of a Location header. NOTE: the JavaScript executes outside of the context of the HTTP site.
980	CVE-2009-3010	79		XSS	2009-08-31	2017-08-16	4.3	None	Remote	Medium	Not required	None	Partial	None	Mozilla Firefox 3.0.13 and earlier, 3.5, 3.6 a1 pre, and 3.7 a1 pre; SeaMonkey 1.1.17; and Mozilla 1.7.x and earlier do not properly block data: URIs in Refresh headers in HTTP responses, which allows remote attackers to conduct cross-site scripting (XSS) attacks via vectors related to (1) injecting a Refresh header that contains JavaScript sequences in a data:text/html URI or (2) entering a data:text/html URI with JavaScript sequences when specifying the content of a Refresh header. NOTE: in some product versions, the JavaScript executes outside of the context of the HTTP site.
981	CVE-2009-3007				2009-08-28	2017-08-16	4.3	None	Remote	Medium	Not required	None	Partial	None	Mozilla Firefox 3.5.1 and SeaMonkey 1.1.17, and Flock 2.5.1, allow context-dependent attackers to spoof the address bar, via window.open with a relative URI, to show an arbitrary file: URL after a victim has visited any file: URL, as demonstrated by a visit to a file: document written by the attacker.
982	CVE-2009-2975			DoS	2009-08-27	2017-08-16	5.0	None	Remote	Low	Not required	None	None	Partial	Mozilla Firefox 3.5.2 on Windows XP, in some situations possibly involving an incompletely configured protocol handler, does not properly implement setting the document.location property to a value specifying a protocol associated with an external application, which allows remote attackers to cause a denial of service (memory consumption) via vectors involving a series of function calls that set this property, as demonstrated by (1) the chromehtml: protocol and (2) the aim: protocol.
983	CVE-2009-2953	399		DoS	2009-08-24	2009-08-25	5.0	None	Remote	Low	Not required	None	None	Partial	Mozilla Firefox 3.0.6 through 3.0.13, and 3.5.x, allows remote attackers to cause a denial of service (CPU consumption) via JavaScript code with a long string value for the hash property (aka location.hash), a related issue to CVE-2008-5715.
984	CVE-2009-2665	94			2009-08-04	2009-09-04	10.0	None	Remote	Low	Not required	Complete	Complete	Complete	The nsDocument::SetScriptGlobalObject function in content/base/src/nsDocument.cpp in Mozilla Firefox 3.5.x before 3.5.2, when certain add-ons are enabled, does not properly handle a Link HTTP header, which allows remote attackers to execute arbitrary JavaScript with chrome privileges via a crafted web page, related to an incorrect security wrapper.
985	CVE-2009-2664	399		DoS Exec Code	2009-08-04	2017-09-18	5.0	None	Remote	Low	Not required	None	None	Partial	The js_watch_set function in js/src/jsdbgapi.cpp in the JavaScript engine in Mozilla Firefox before 3.0.12 allows remote attackers to cause a denial of service (assertion failure and application exit) or possibly execute arbitrary code via a crafted .js file, related to a "memory safety bug." NOTE: this was originally reported as affecting versions before 3.0.13.
986	CVE-2009-2663	399		DoS Exec Code Mem. Corr.	2009-08-04	2017-09-18	9.3	None	Remote	Medium	Not required	Complete	Complete	Complete	libvorbis before r16182, as used in Mozilla Firefox 3.5.x before 3.5.2 and other products, allows context-dependent attackers to cause a denial of service (memory corruption and application crash) or possibly execute arbitrary code via a crafted .ogg file.
987	CVE-2009-2662	119		DoS Exec Code Overflow Mem. Corr.	2009-08-04	2009-09-04	10.0	None	Remote	Low	Not required	Complete	Complete	Complete	The browser engine in Mozilla Firefox 3.5.x before 3.5.2 allows remote attackers to cause a denial of service (memory corruption and application crash) or possibly execute arbitrary code via vectors related to the TraceRecorder::snapshot function in js/src/jstracer.cpp, and unspecified other vectors.
988	CVE-2009-2654	20			2009-08-03	2017-09-18	5.8	None	Remote	Medium	Not required	None	Partial	Partial	Mozilla Firefox before 3.0.13, and 3.5.x before 3.5.2, allows remote attackers to spoof the address bar, and possibly conduct phishing attacks, via a crafted web page that calls window.open with an invalid character in the URL, makes document.write calls to the resulting object, and then calls the stop method during the loading of the error page.
989	CVE-2009-2535	189	1	DoS	2009-07-20	2017-09-18	5.0	None	Remote	Low	Not required	None	None	Partial	Mozilla Firefox before 2.0.0.19 and 3.x before 3.0.5, SeaMonkey, and Thunderbird allow remote attackers to cause a denial of service (memory consumption and application crash) via a large integer value for the length property of a Select object, a related issue to CVE-2009-1692.
990	CVE-2009-2479	119	1	DoS Overflow	2009-07-16	2017-09-18	7.8	None	Remote	Low	Not required	None	None	Complete	Mozilla Firefox 3.0.x, 3.5, and 3.5.1 on Windows allows remote attackers to cause a denial of service (uncaught exception and application crash) via a long Unicode string argument to the write method. NOTE: this was originally reported as a stack-based buffer overflow. NOTE: on Linux and Mac OS X, a crash resulting from this long string reportedly occurs in an operating-system library, not in Firefox.
991	CVE-2009-2478	189		DoS	2009-07-16	2009-08-07	5.0	None	Remote	Low	Not required	None	None	Partial	Mozilla Firefox 3.5 allows remote attackers to cause a denial of service (NULL pointer dereference and application crash) via unspecified vectors, related to a "flash bug."
992	CVE-2009-2477	94	2	Exec Code	2009-07-15	2017-09-18	9.3	None	Remote	Medium	Not required	Complete	Complete	Complete	js/src/jstracer.cpp in the Just-in-time (JIT) JavaScript compiler (aka TraceMonkey) in Mozilla Firefox 3.5 before 3.5.1 allows remote attackers to execute arbitrary code via certain use of the escape function that triggers access to uninitialized memory locations, as originally demonstrated by a document containing P and FONT elements.
993	CVE-2009-2472	79		XSS Bypass	2009-07-22	2017-09-18	4.3	None	Remote	Medium	Not required	None	Partial	None	Mozilla Firefox before 3.0.12 does not always use XPCCrossOriginWrapper when required during object construction, which allows remote attackers to bypass the Same Origin Policy and conduct cross-site scripting (XSS) attacks via a crafted document, related to a "cross origin wrapper bypass."
994	CVE-2009-2471				2009-07-22	2017-09-18	10.0	None	Remote	Low	Not required	Complete	Complete	Complete	The setTimeout function in Mozilla Firefox before 3.0.12 does not properly preserve object wrapping, which allows remote attackers to execute arbitrary JavaScript with chrome privileges via a crafted call, related to XPCNativeWrapper.
995	CVE-2009-2470	20		DoS	2009-08-04	2017-09-18	5.0	None	Remote	Low	Not required	None	None	Partial	Mozilla Firefox before 3.0.12, and 3.5.x before 3.5.2, allows remote SOCKS5 proxy servers to cause a denial of service (data stream corruption) via a long domain name in a reply.
996	CVE-2009-2469	399		DoS Exec Code Mem. Corr.	2009-07-22	2017-09-18	10.0	None	Remote	Low	Not required	Complete	Complete	Complete	Mozilla Firefox before 3.0.12 does not properly handle an SVG element that has a property with a watch function and an __defineSetter__ function, which allows remote attackers to cause a denial of service (memory corruption and application crash) or possibly execute arbitrary code via a crafted document, related to a certain pointer misinterpretation.
997	CVE-2009-2468	189		DoS Exec Code Overflow	2009-07-22	2009-09-16	10.0	None	Remote	Low	Not required	Complete	Complete	Complete	Integer overflow in Apple CoreGraphics, as used in Safari before 4.0.3, Mozilla Firefox before 3.0.12, and Mac OS X 10.4.11 and 10.5.8, allows remote attackers to cause a denial of service (application crash) or possibly execute arbitrary code via a long text run that triggers a heap-based buffer overflow during font glyph rendering, a related issue to CVE-2009-1194.
998	CVE-2009-2467			DoS Exec Code	2009-07-22	2017-09-18	10.0	None	Remote	Low	Not required	Complete	Complete	Complete	Mozilla Firefox before 3.0.12 and 3.5 before 3.5.1 allows remote attackers to cause a denial of service (application crash) or possibly execute arbitrary code via vectors involving a Flash object, a slow script dialog, and the unloading of the Flash plugin, which triggers attempted use of a deleted object.
999	CVE-2009-2466	399		DoS Exec Code Mem. Corr.	2009-07-22	2017-09-18	10.0	None	Remote	Low	Not required	Complete	Complete	Complete	The JavaScript engine in Mozilla Firefox before 3.0.12 and Thunderbird allows remote attackers to cause a denial of service (memory corruption and application crash) or possibly execute arbitrary code via vectors related to (1) nsDOMClassInfo.cpp, (2) JS_HashTableRawLookup, and (3) MirrorWrappedNativeParent and js_LockGCThingRT.
1000	CVE-2009-2465	399		DoS Exec Code Mem. Corr.	2009-07-22	2017-09-18	10.0	None	Remote	Low	Not required	Complete	Complete	Complete	Mozilla Firefox before 3.0.12 and Thunderbird allow remote attackers to cause a denial of service (memory corruption and application crash) or execute arbitrary code via vectors involving double frame construction, related to (1) nsHTMLContentSink.cpp, (2) nsXMLContentSink.cpp, and (3) nsPresShell.cpp, and the nsSubDocumentFrame::Reflow function.
