#	CVE ID	CWE ID	# of Exploits	Vulnerability Type(s)	Publish Date	Update Date	Score	Gained Access Level	Access	Complexity	Authentication	Conf.	Integ.	Avail.
401	CVE-2014-1497	119		DoS Overflow +Info	2014-03-19	2016-12-21	6.8	None	Remote	Medium	Not required	Partial	Partial	Partial	The mozilla::WaveReader::DecodeAudioData function in Mozilla Firefox before 28.0, Firefox ESR 24.x before 24.4, Thunderbird before 24.4, and SeaMonkey before 2.25 allows remote attackers to obtain sensitive information from process heap memory, cause a denial of service (out-of-bounds read and application crash), or possibly have unspecified other impact via a crafted WAV file.
402	CVE-2014-1496	264		+Priv	2014-03-19	2016-12-21	6.9	None	Local	Medium	Not required	Complete	Complete	Complete	Mozilla Firefox before 28.0, Firefox ESR 24.x before 24.4, Thunderbird before 24.4, and SeaMonkey before 2.25 might allow local users to gain privileges by modifying the extracted Mar contents during an update.
403	CVE-2014-1494			DoS Exec Code Mem. Corr.	2014-03-19	2016-12-21	9.3	None	Remote	Medium	Not required	Complete	Complete	Complete	Multiple unspecified vulnerabilities in the browser engine in Mozilla Firefox before 28.0 and SeaMonkey before 2.25 allow remote attackers to cause a denial of service (memory corruption and application crash) or possibly execute arbitrary code via unknown vectors.
404	CVE-2014-1493			DoS Exec Code Mem. Corr.	2014-03-19	2016-12-21	9.3	None	Remote	Medium	Not required	Complete	Complete	Complete	Multiple unspecified vulnerabilities in the browser engine in Mozilla Firefox before 28.0, Firefox ESR 24.x before 24.4, Thunderbird before 24.4, and SeaMonkey before 2.25 allow remote attackers to cause a denial of service (memory corruption and application crash) or possibly execute arbitrary code via unknown vectors.
405	CVE-2014-1491	310		Bypass	2014-02-06	2017-11-14	5.0	None	Remote	Low	Not required	None	Partial	None	Mozilla Network Security Services (NSS) before 3.15.4, as used in Mozilla Firefox before 27.0, Firefox ESR 24.x before 24.3, Thunderbird before 24.3, SeaMonkey before 2.24, and other products, does not properly restrict public values in Diffie-Hellman key exchanges, which makes it easier for remote attackers to bypass cryptographic protection mechanisms in ticket handling by leveraging use of a certain value.
406	CVE-2014-1490	399		DoS	2014-02-06	2017-11-14	5.0	None	Remote	Low	Not required	None	None	Partial	Race condition in libssl in Mozilla Network Security Services (NSS) before 3.15.4, as used in Mozilla Firefox before 27.0, Firefox ESR 24.x before 24.3, Thunderbird before 24.3, SeaMonkey before 2.24, and other products, allows remote attackers to cause a denial of service (use-after-free) or possibly have unspecified other impact via vectors involving a resumption handshake that triggers incorrect replacement of a session ticket.
407	CVE-2014-1489	264		DoS	2014-02-06	2016-12-21	4.3	None	Remote	Medium	Not required	None	None	Partial	Mozilla Firefox before 27.0 does not properly restrict access to about:home buttons by script on other pages, which allows user-assisted remote attackers to cause a denial of service (session restore) via a crafted web site.
408	CVE-2014-1488	399		Exec Code	2014-02-06	2016-12-21	10.0	None	Remote	Low	Not required	Complete	Complete	Complete	The Web workers implementation in Mozilla Firefox before 27.0 and SeaMonkey before 2.24 allows remote attackers to execute arbitrary code via vectors involving termination of a worker process that has performed a cross-thread object-passing operation in conjunction with use of asm.js.
409	CVE-2014-1487	255		Bypass +Info	2014-02-06	2016-12-21	5.0	None	Remote	Low	Not required	Partial	None	None	The Web workers implementation in Mozilla Firefox before 27.0, Firefox ESR 24.x before 24.3, Thunderbird before 24.3, and SeaMonkey before 2.24 allows remote attackers to bypass the Same Origin Policy and obtain sensitive authentication information via vectors involving error messages.
410	CVE-2014-1486	399		Exec Code	2014-02-06	2016-12-21	10.0	None	Remote	Low	Not required	Complete	Complete	Complete	Use-after-free vulnerability in the imgRequestProxy function in Mozilla Firefox before 27.0, Firefox ESR 24.x before 24.3, Thunderbird before 24.3, and SeaMonkey before 2.24 allows remote attackers to execute arbitrary code via vectors involving unspecified Content-Type values for image data.
411	CVE-2014-1485			Exec Code	2014-02-06	2016-12-21	7.5	None	Remote	Low	Not required	Partial	Partial	Partial	The Content Security Policy (CSP) implementation in Mozilla Firefox before 27.0 and SeaMonkey before 2.24 operates on XSLT stylesheets according to style-src directives instead of script-src directives, which might allow remote attackers to execute arbitrary XSLT code by leveraging insufficient style-src restrictions.
412	CVE-2014-1484	200		+Info	2014-02-06	2016-11-15	5.0	None	Remote	Low	Not required	Partial	None	None	Mozilla Firefox before 27.0 on Android 4.2 and earlier creates system-log entries containing profile paths, which allows attackers to obtain sensitive information via a crafted application.
413	CVE-2014-1483	200		Bypass +Info	2014-02-06	2016-12-21	4.3	None	Remote	Medium	Not required	Partial	None	None	Mozilla Firefox before 27.0 and SeaMonkey before 2.24 allow remote attackers to bypass the Same Origin Policy and obtain sensitive information by using an IFRAME element in conjunction with certain timing measurements involving the document.caretPositionFromPoint and document.elementFromPoint functions.
414	CVE-2014-1482	264		DoS Exec Code	2014-02-06	2016-12-21	10.0	None	Remote	Low	Not required	Complete	Complete	Complete	RasterImage.cpp in Mozilla Firefox before 27.0, Firefox ESR 24.x before 24.3, Thunderbird before 24.3, and SeaMonkey before 2.24 does not prevent access to discarded data, which allows remote attackers to execute arbitrary code or cause a denial of service (incorrect write operations) via crafted image data, as demonstrated by Goo Create.
415	CVE-2014-1481	264		Bypass	2014-02-06	2016-12-21	5.0	None	Remote	Low	Not required	None	Partial	None	Mozilla Firefox before 27.0, Firefox ESR 24.x before 24.3, Thunderbird before 24.3, and SeaMonkey before 2.24 allow remote attackers to bypass intended restrictions on window objects by leveraging inconsistency in native getter methods across different JavaScript engines.
416	CVE-2014-1480	20			2014-02-06	2016-12-21	4.3	None	Remote	Medium	Not required	None	Partial	None	The file-download implementation in Mozilla Firefox before 27.0 and SeaMonkey before 2.24 does not properly restrict the timing of button selections, which allows remote attackers to conduct clickjacking attacks, and trigger unintended launching of a downloaded file, via a crafted web site.
417	CVE-2014-1479	264		Bypass	2014-02-06	2016-12-21	5.0	None	Remote	Low	Not required	None	Partial	None	The System Only Wrapper (SOW) implementation in Mozilla Firefox before 27.0, Firefox ESR 24.x before 24.3, Thunderbird before 24.3, and SeaMonkey before 2.24 does not prevent certain cloning operations, which allows remote attackers to bypass intended restrictions on XUL content via vectors involving XBL content scopes.
418	CVE-2014-1478			DoS Exec Code Mem. Corr.	2014-02-06	2016-12-21	10.0	None	Remote	Low	Not required	Complete	Complete	Complete	Multiple unspecified vulnerabilities in the browser engine in Mozilla Firefox before 27.0 and SeaMonkey before 2.24 allow remote attackers to cause a denial of service (memory corruption and application crash) or possibly execute arbitrary code via vectors related to the MPostWriteBarrier class in js/src/jit/MIR.h and stack alignment in js/src/jit/AsmJS.cpp in OdinMonkey, and unknown other vectors.
419	CVE-2014-1477			DoS Exec Code Mem. Corr.	2014-02-06	2016-12-21	10.0	None	Remote	Low	Not required	Complete	Complete	Complete	Multiple unspecified vulnerabilities in the browser engine in Mozilla Firefox before 27.0, Firefox ESR 24.x before 24.3, Thunderbird before 24.3, and SeaMonkey before 2.24 allow remote attackers to cause a denial of service (memory corruption and application crash) or possibly execute arbitrary code via unknown vectors.
420	CVE-2013-6673	310			2013-12-11	2016-12-21	5.8	None	Remote	Medium	Not required	None	Partial	Partial	Mozilla Firefox before 26.0, Firefox ESR 24.x before 24.2, Thunderbird before 24.2, and SeaMonkey before 2.23 do not recognize a user's removal of trust from an EV X.509 certificate, which makes it easier for man-in-the-middle attackers to spoof SSL servers in opportunistic circumstances via a valid certificate that is unacceptable to the user.
421	CVE-2013-6672	200		+Info	2013-12-11	2016-12-21	4.3	None	Remote	Medium	Not required	Partial	None	None	Mozilla Firefox before 26.0 and SeaMonkey before 2.23 on Linux allow user-assisted remote attackers to read clipboard data by leveraging certain middle-click paste operations.
422	CVE-2013-6671	94		Exec Code	2013-12-11	2016-12-21	9.3	None	Remote	Medium	Not required	Complete	Complete	Complete	The nsGfxScrollFrameInner::IsLTR function in Mozilla Firefox before 26.0, Firefox ESR 24.x before 24.2, Thunderbird before 24.2, and SeaMonkey before 2.23 allows remote attackers to execute arbitrary code via crafted use of JavaScript code for ordered list elements.
423	CVE-2013-6167	352		CSRF	2014-02-15	2014-02-18	6.8	None	Remote	Medium	Not required	Partial	Partial	Partial	Mozilla Firefox through 27 sends HTTP Cookie headers without first validating that they have the required character-set restrictions, which allows remote attackers to conduct the equivalent of a persistent Logout CSRF attack via a crafted parameter that forces a web application to set a malformed cookie within an HTTP response.
424	CVE-2013-5619	189		DoS Overflow	2013-12-11	2016-12-21	6.8	None	Remote	Medium	Not required	Partial	Partial	Partial	Multiple integer overflows in the binary-search implementation in SpiderMonkey in Mozilla Firefox before 26.0 and SeaMonkey before 2.23 might allow remote attackers to cause a denial of service (out-of-bounds array access) or possibly have unspecified other impact via crafted JavaScript code.
425	CVE-2013-5618	399		Exec Code	2013-12-11	2016-12-21	10.0	None	Remote	Low	Not required	Complete	Complete	Complete	Use-after-free vulnerability in the nsNodeUtils::LastRelease function in the table-editing user interface in the editor component in Mozilla Firefox before 26.0, Firefox ESR 24.x before 24.2, Thunderbird before 24.2, and SeaMonkey before 2.23 allows remote attackers to execute arbitrary code by triggering improper garbage collection.
426	CVE-2013-5616	399		DoS Exec Code Mem. Corr.	2013-12-11	2016-12-21	10.0	None	Remote	Low	Not required	Complete	Complete	Complete	Use-after-free vulnerability in the nsEventListenerManager::HandleEventSubType function in Mozilla Firefox before 26.0, Firefox ESR 24.x before 24.2, Thunderbird before 24.2, and SeaMonkey before 2.23 allows remote attackers to execute arbitrary code or cause a denial of service (heap memory corruption) via vectors related to mListeners event listeners.
427	CVE-2013-5615	264			2013-12-11	2016-12-21	10.0	None	Remote	Low	Not required	Complete	Complete	Complete	The JavaScript implementation in Mozilla Firefox before 26.0, Firefox ESR 24.x before 24.2, Thunderbird before 24.2, and SeaMonkey before 2.23 does not properly enforce certain typeset restrictions on the generation of GetElementIC typed array stubs, which has unspecified impact and remote attack vectors.
428	CVE-2013-5614	264		Bypass	2013-12-11	2016-12-21	4.3	None	Remote	Medium	Not required	None	Partial	None	Mozilla Firefox before 26.0 and SeaMonkey before 2.23 do not properly consider the sandbox attribute of an IFRAME element during processing of a contained OBJECT element, which allows remote attackers to bypass intended sandbox restrictions via a crafted web site.
429	CVE-2013-5613			DoS Exec Code Mem. Corr.	2013-12-11	2016-12-21	10.0	None	Remote	Low	Not required	Complete	Complete	Complete	Use-after-free vulnerability in the PresShell::DispatchSynthMouseMove function in Mozilla Firefox before 26.0, Firefox ESR 24.x before 24.2, Thunderbird before 24.2, and SeaMonkey before 2.23 allows remote attackers to execute arbitrary code or cause a denial of service (heap memory corruption) via vectors involving synthetic mouse movement, related to the RestyleManager::GetHoverGeneration function.
430	CVE-2013-5612	79		XSS	2013-12-11	2016-12-21	4.3	None	Remote	Medium	Not required	None	Partial	None	Cross-site scripting (XSS) vulnerability in Mozilla Firefox before 26.0 and SeaMonkey before 2.23 makes it easier for remote attackers to inject arbitrary web script or HTML by leveraging a Same Origin Policy violation triggered by lack of a charset parameter in a Content-Type HTTP header.
431	CVE-2013-5611				2013-12-11	2016-11-15	5.8	None	Remote	Medium	Not required	None	Partial	Partial	Mozilla Firefox before 26.0 does not properly remove the Application Installation doorhanger, which makes it easier for remote attackers to spoof a Web App installation site by controlling the timing of page navigation.
432	CVE-2013-5610			DoS Exec Code Mem. Corr.	2013-12-11	2016-12-21	10.0	None	Remote	Low	Not required	Complete	Complete	Complete	Multiple unspecified vulnerabilities in the browser engine in Mozilla Firefox before 26.0 and SeaMonkey before 2.23 allow remote attackers to cause a denial of service (memory corruption and application crash) or possibly execute arbitrary code via unknown vectors.
433	CVE-2013-5609			DoS Exec Code Mem. Corr.	2013-12-11	2016-12-21	10.0	None	Remote	Low	Not required	Complete	Complete	Complete	Multiple unspecified vulnerabilities in the browser engine in Mozilla Firefox before 26.0, Firefox ESR 24.x before 24.2, Thunderbird before 24.2, and SeaMonkey before 2.23 allow remote attackers to cause a denial of service (memory corruption and application crash) or possibly execute arbitrary code via unknown vectors.
434	CVE-2013-5607	189		DoS Overflow	2013-11-20	2016-12-30	7.5	None	Remote	Low	Not required	Partial	Partial	Partial	Integer overflow in the PL_ArenaAllocate function in Mozilla Netscape Portable Runtime (NSPR) before 4.10.2, as used in Firefox before 25.0.1, Firefox ESR 17.x before 17.0.11 and 24.x before 24.1.1, and SeaMonkey before 2.22.1, allows remote attackers to cause a denial of service (application crash) or possibly have unspecified other impact via a crafted X.509 certificate, a related issue to CVE-2013-1741.
435	CVE-2013-5604	119		DoS Exec Code Overflow	2013-10-30	2017-09-18	9.3	None	Remote	Medium	Not required	Complete	Complete	Complete	The txXPathNodeUtils::getBaseURI function in the XSLT processor in Mozilla Firefox before 25.0, Firefox ESR 17.x before 17.0.10 and 24.x before 24.1, Thunderbird before 24.1, Thunderbird ESR 17.x before 17.0.10, and SeaMonkey before 2.22 does not properly initialize data, which allows remote attackers to execute arbitrary code or cause a denial of service (stack-based buffer overflow and application crash) via crafted documents.
436	CVE-2013-5603			DoS Exec Code Mem. Corr.	2013-10-30	2017-09-18	10.0	None	Remote	Low	Not required	Complete	Complete	Complete	Use-after-free vulnerability in the nsContentUtils::ContentIsHostIncludingDescendantOf function in Mozilla Firefox before 25.0, Firefox ESR 24.x before 24.1, Thunderbird before 24.1, and SeaMonkey before 2.22 allows remote attackers to execute arbitrary code or cause a denial of service (heap memory corruption) via vectors involving HTML document templates.
437	CVE-2013-5602	119		DoS Exec Code Overflow Mem. Corr.	2013-10-30	2017-09-18	10.0	None	Remote	Low	Not required	Complete	Complete	Complete	The Worker::SetEventListener function in the Web workers implementation in Mozilla Firefox before 25.0, Firefox ESR 17.x before 17.0.10 and 24.x before 24.1, Thunderbird before 24.1, Thunderbird ESR 17.x before 17.0.10, and SeaMonkey before 2.22 allows remote attackers to execute arbitrary code or cause a denial of service (memory corruption) via vectors related to direct proxies.
438	CVE-2013-5601			Exec Code	2013-10-30	2017-09-18	10.0	None	Remote	Low	Not required	Complete	Complete	Complete	Use-after-free vulnerability in the nsEventListenerManager::SetEventHandler function in Mozilla Firefox before 25.0, Firefox ESR 17.x before 17.0.10 and 24.x before 24.1, Thunderbird before 24.1, Thunderbird ESR 17.x before 17.0.10, and SeaMonkey before 2.22 allows remote attackers to execute arbitrary code via vectors related to a memory allocation through the garbage collection (GC) API.
439	CVE-2013-5600			Exec Code	2013-10-30	2017-09-18	10.0	None	Remote	Low	Not required	Complete	Complete	Complete	Use-after-free vulnerability in the nsIOService::NewChannelFromURIWithProxyFlags function in Mozilla Firefox before 25.0, Firefox ESR 17.x before 17.0.10 and 24.x before 24.1, Thunderbird before 24.1, Thunderbird ESR 17.x before 17.0.10, and SeaMonkey before 2.22 allows remote attackers to execute arbitrary code via vectors involving a blob: URL.
440	CVE-2013-5599			DoS Exec Code Mem. Corr.	2013-10-30	2017-09-18	10.0	None	Remote	Low	Not required	Complete	Complete	Complete	Use-after-free vulnerability in the nsIPresShell::GetPresContext function in the PresShell (aka presentation shell) implementation in Mozilla Firefox before 25.0, Firefox ESR 17.x before 17.0.10 and 24.x before 24.1, Thunderbird before 24.1, Thunderbird ESR 17.x before 17.0.10, and SeaMonkey before 2.22 allows remote attackers to execute arbitrary code or cause a denial of service (heap memory corruption and application crash) via vectors involving a CANVAS element, a mozTextStyle attribute, and an onresize event.
441	CVE-2013-5598	264		Exec Code	2013-10-30	2017-09-18	8.3	None	Remote	Medium	Not required	Complete	Partial	Partial	PDF.js in Mozilla Firefox before 25.0 and Firefox ESR 24.x before 24.1 does not properly handle the appending of an IFRAME element, which allows remote attackers to read arbitrary files or execute arbitrary JavaScript code with chrome privileges by using this element within an embedded PDF object.
442	CVE-2013-5597			DoS Exec Code Mem. Corr.	2013-10-30	2017-09-18	10.0	None	Remote	Low	Not required	Complete	Complete	Complete	Use-after-free vulnerability in the nsDocLoader::doStopDocumentLoad function in Mozilla Firefox before 25.0, Firefox ESR 17.x before 17.0.10 and 24.x before 24.1, Thunderbird before 24.1, Thunderbird ESR 17.x before 17.0.10, and SeaMonkey before 2.22 allows remote attackers to execute arbitrary code or cause a denial of service (heap memory corruption) via vectors involving a state-change event during an update of the offline cache.
443	CVE-2013-5596	119		DoS Exec Code Overflow	2013-10-30	2017-09-18	6.8	None	Remote	Medium	Not required	Partial	Partial	Partial	The cycle collection (CC) implementation in Mozilla Firefox before 25.0, Firefox ESR 24.x before 24.1, Thunderbird before 24.1, and SeaMonkey before 2.22 does not properly determine the thread for release of an image object, which allows remote attackers to execute arbitrary code or cause a denial of service (race condition and application crash) via a large HTML document containing IMG elements, as demonstrated by the Never-Ending Reddit on reddit.com.
444	CVE-2013-5595	119		Overflow	2013-10-30	2017-09-18	4.3	None	Remote	Medium	Not required	None	None	Partial	The JavaScript engine in Mozilla Firefox before 25.0, Firefox ESR 17.x before 17.0.10 and 24.x before 24.1, Thunderbird before 24.1, Thunderbird ESR 17.x before 17.0.10, and SeaMonkey before 2.22 does not properly allocate memory for unspecified functions, which allows remote attackers to conduct buffer overflow attacks via a crafted web page.
445	CVE-2013-5593	20			2013-10-30	2017-09-18	4.3	None	Remote	Medium	Not required	None	Partial	None	The SELECT element implementation in Mozilla Firefox before 25.0, Firefox ESR 24.x before 24.1, Thunderbird before 24.1, and SeaMonkey before 2.22 does not properly restrict the nature or placement of HTML within a dropdown menu, which allows remote attackers to spoof the address bar or conduct clickjacking attacks via vectors that trigger navigation off of a page containing this element.
446	CVE-2013-5592			DoS Exec Code Mem. Corr.	2013-10-30	2017-09-18	10.0	None	Remote	Low	Not required	Complete	Complete	Complete	Multiple unspecified vulnerabilities in the browser engine in Mozilla Firefox before 25.0 allow remote attackers to cause a denial of service (memory corruption and application crash) or possibly execute arbitrary code via unknown vectors.
447	CVE-2013-5591			DoS Exec Code Mem. Corr.	2013-10-30	2017-09-18	10.0	None	Remote	Low	Not required	Complete	Complete	Complete	Unspecified vulnerability in the browser engine in Mozilla Firefox before 25.0, Firefox ESR 24.x before 24.1, Thunderbird before 24.1, and SeaMonkey before 2.22 allows remote attackers to cause a denial of service (memory corruption and application crash) or possibly execute arbitrary code via unknown vectors.
448	CVE-2013-5590			DoS Exec Code Mem. Corr.	2013-10-30	2017-09-18	10.0	None	Remote	Low	Not required	Complete	Complete	Complete	Multiple unspecified vulnerabilities in the browser engine in Mozilla Firefox before 25.0, Firefox ESR 17.x before 17.0.10 and 24.x before 24.1, Thunderbird before 24.1, Thunderbird ESR 17.x before 17.0.10, and SeaMonkey before 2.22 allow remote attackers to cause a denial of service (memory corruption and application crash) or possibly execute arbitrary code via unknown vectors.
449	CVE-2013-2566	310			2013-03-15	2017-10-19	4.3	None	Remote	Medium	Not required	Partial	None	None	The RC4 algorithm, as used in the TLS protocol and SSL protocol, has many single-byte biases, which makes it easier for remote attackers to conduct plaintext-recovery attacks via statistical analysis of ciphertext in a large number of sessions that use the same plaintext.
450	CVE-2013-1738	399		Exec Code	2013-09-18	2017-09-18	9.3	None	Remote	Medium	Not required	Complete	Complete	Complete	Use-after-free vulnerability in the JS_GetGlobalForScopeChain function in Mozilla Firefox before 24.0, Thunderbird before 24.0, and SeaMonkey before 2.21 allows remote attackers to execute arbitrary code by leveraging incorrect garbage collection in situations involving default compartments and frame-chain restoration.
