#	CVE ID	CWE ID	# of Exploits	Vulnerability Type(s)	Publish Date	Update Date	Score	Gained Access Level	Access	Complexity	Authentication	Conf.	Integ.	Avail.
1001	CVE-2009-2464	399		DoS Exec Code Mem. Corr.	2009-07-22	2017-09-18	10.0	None	Remote	Low	Not required	Complete	Complete	Complete	The nsXULTemplateQueryProcessorRDF::CheckIsSeparator function in Mozilla Firefox before 3.0.12, SeaMonkey 2.0a1pre, and Thunderbird allows remote attackers to cause a denial of service (memory corruption and application crash) or possibly execute arbitrary code via vectors related to loading multiple RDF files in a XUL tree element.
1002	CVE-2009-2463	189		DoS Exec Code Overflow Mem. Corr.	2009-07-22	2017-09-18	10.0	None	Remote	Low	Not required	Complete	Complete	Complete	Multiple integer overflows in the (1) PL_Base64Decode and (2) PL_Base64Encode functions in nsprpub/lib/libc/src/base64.c in Mozilla Firefox before 3.0.12, Thunderbird before 2.0.0.24, and SeaMonkey before 1.1.19 allow remote attackers to cause a denial of service (memory corruption and application crash) or possibly execute arbitrary code via unspecified vectors that trigger buffer overflows.
1003	CVE-2009-2462	399		DoS Exec Code Mem. Corr.	2009-07-22	2017-09-18	10.0	None	Remote	Low	Not required	Complete	Complete	Complete	The browser engine in Mozilla Firefox before 3.0.12 and Thunderbird allows remote attackers to cause a denial of service (memory corruption and application crash) or possibly execute arbitrary code via vectors related to (1) the frame chain and synchronous events, (2) a SetMayHaveFrame assertion and nsCSSFrameConstructor::CreateFloatingLetterFrame, (3) nsCSSFrameConstructor::ConstructFrame, (4) the child list and initial reflow, (5) GetLastSpecialSibling, (6) nsFrameManager::GetPrimaryFrameFor and MathML, (7) nsFrame::GetBoxAscent, (8) nsCSSFrameConstructor::AdjustParentFrame, (9) nsDOMOfflineResourceList, and (10) nsContentUtils::ComparePosition.
1004	CVE-2009-2409	310			2009-07-30	2017-09-18	5.1	None	Remote	High	Not required	Partial	Partial	Partial	The Network Security Services (NSS) library before 3.12.3, as used in Firefox; GnuTLS before 2.6.4 and 2.7.4; OpenSSL 0.9.8 through 0.9.8k; and other products support MD2 with X.509 certificates, which might allow remote attackers to spoof certificates by using MD2 design flaws to generate a hash collision in less than brute-force time. NOTE: the scope of this issue is currently limited because the amount of computation required is still large.
1005	CVE-2009-2408	20			2009-07-30	2017-09-18	6.8	None	Remote	Medium	Not required	Partial	Partial	Partial	Mozilla Network Security Services (NSS) before 3.12.3, Firefox before 3.0.13, Thunderbird before 2.0.0.23, and SeaMonkey before 1.1.18 do not properly handle a '\0' character in a domain name in the subject's Common Name (CN) field of an X.509 certificate, which allows man-in-the-middle attackers to spoof arbitrary SSL servers via a crafted certificate issued by a legitimate Certification Authority. NOTE: this was originally reported for Firefox before 3.5.
1006	CVE-2009-2065	287			2009-06-15	2017-08-16	6.8	None	Remote	Medium	Not required	Partial	Partial	Partial	Mozilla Firefox 3.0.10, and possibly other versions, detects http content in https web pages only when the top-level frame uses https, which allows man-in-the-middle attackers to execute arbitrary web script, in an https site's context, by modifying an http page to include an https iframe that references a script file on an http site, related to "HTTP-Intended-but-HTTPS-Loadable (HPIHSL) pages."
1007	CVE-2009-2061	310			2009-06-15	2017-08-16	9.3	None	Remote	Medium	Not required	Complete	Complete	Complete	Mozilla Firefox before 3.0.10 processes a 3xx HTTP CONNECT response before a successful SSL handshake, which allows man-in-the-middle attackers to execute arbitrary web script, in an https site's context, by modifying this CONNECT response to specify a 302 redirect to an arbitrary https web site.
1008	CVE-2009-2044	20		DoS	2009-06-12	2017-08-16	4.3	None	Remote	Medium	Not required	None	None	Partial	Mozilla Firefox 3.0.10 and earlier on Linux allows remote attackers to cause a denial of service (application crash) via a URI for a large GIF image in the BACKGROUND attribute of a BODY element.
1009	CVE-2009-2043	20		DoS	2009-06-12	2017-08-16	4.3	None	Remote	Medium	Not required	None	None	Partial	nsViewManager.cpp in Mozilla Firefox 3.0.2 through 3.0.10 allows remote attackers to cause a denial of service (NULL pointer dereference and application crash) via vectors related to interaction with TinyMCE.
1010	CVE-2009-1841	94			2009-06-12	2017-09-28	9.3	None	Remote	Medium	Not required	Complete	Complete	Complete	js/src/xpconnect/src/xpcwrappedjsclass.cpp in Mozilla Firefox before 3.0.11, Thunderbird before 2.0.0.22, and SeaMonkey before 1.1.17 allows remote attackers to execute arbitrary web script with the privileges of a chrome object, as demonstrated by the browser sidebar and the FeedWriter.
1011	CVE-2009-1840	264		Bypass	2009-06-12	2017-09-28	9.3	None	Remote	Medium	Not required	Complete	Complete	Complete	Mozilla Firefox before 3.0.11, Thunderbird, and SeaMonkey do not check content policy before loading a script file into a XUL document, which allows remote attackers to bypass intended access restrictions via a crafted HTML document, as demonstrated by a "web bug" in an e-mail message, or web script or an advertisement in a web page.
1012	CVE-2009-1839	264		Bypass	2009-06-12	2017-09-28	5.4	None	Remote	High	Not required	Complete	None	None	Mozilla Firefox 3 before 3.0.11 associates an incorrect principal with a file: URL loaded through the location bar, which allows user-assisted remote attackers to bypass intended access restrictions and read files via a crafted HTML document, aka a "file-URL-to-file-URL scripting" attack.
1013	CVE-2009-1838	94			2009-06-12	2017-09-28	9.3	None	Remote	Medium	Not required	Complete	Complete	Complete	The garbage-collection implementation in Mozilla Firefox before 3.0.11, Thunderbird before 2.0.0.22, and SeaMonkey before 1.1.17 sets an element's owner document to null in unspecified circumstances, which allows remote attackers to execute arbitrary JavaScript with chrome privileges via a crafted event handler, related to an incorrect context for this event handler.
1014	CVE-2009-1837	362		Exec Code	2009-06-12	2017-09-28	9.3	None	Remote	Medium	Not required	Complete	Complete	Complete	Race condition in the NPObjWrapper_NewResolve function in modules/plugin/base/src/nsJSNPRuntime.cpp in xul.dll in Mozilla Firefox 3 before 3.0.11 might allow remote attackers to execute arbitrary code via a page transition during Java applet loading, related to a use-after-free vulnerability for memory associated with a destroyed Java object.
1015	CVE-2009-1836	287			2009-06-12	2017-09-28	6.8	None	Remote	Medium	Not required	Partial	Partial	Partial	Mozilla Firefox before 3.0.11, Thunderbird before 2.0.0.22, and SeaMonkey before 1.1.17 use the HTTP Host header to determine the context of a document provided in a non-200 CONNECT response from a proxy server, which allows man-in-the-middle attackers to execute arbitrary web script by modifying this CONNECT response, aka an "SSL tampering" attack.
1016	CVE-2009-1835	200		+Info	2009-06-12	2017-09-28	4.3	None	Remote	Medium	Not required	Partial	None	None	Mozilla Firefox before 3.0.11 and SeaMonkey before 1.1.17 associate local documents with external domain names located after the file:// substring in a URL, which allows user-assisted remote attackers to read arbitrary cookies via a crafted HTML document, as demonstrated by a URL with file://example.com/C:/ at the beginning.
1017	CVE-2009-1834	20			2009-06-12	2017-09-28	4.3	None	Remote	Medium	Not required	None	Partial	None	Visual truncation vulnerability in netwerk/dns/src/nsIDNService.cpp in Mozilla Firefox before 3.0.11 and SeaMonkey before 1.1.17 allows remote attackers to spoof the location bar via an IDN with invalid Unicode characters that are displayed as whitespace, as demonstrated by the \u115A through \u115E characters.
1018	CVE-2009-1833	94		DoS Exec Code Mem. Corr.	2009-06-12	2017-09-28	9.3	None	Remote	Medium	Not required	Complete	Complete	Complete	The JavaScript engine in Mozilla Firefox before 3.0.11, Thunderbird before 2.0.0.22, and SeaMonkey before 1.1.17 allows remote attackers to cause a denial of service (memory corruption and application crash) or possibly execute arbitrary code via vectors related to (1) js_LeaveSharpObject, (2) ParseXMLSource, and (3) a certain assertion in jsinterp.c; and other vectors.
1019	CVE-2009-1832	94		DoS Exec Code Mem. Corr.	2009-06-12	2017-09-28	9.3	None	Remote	Medium	Not required	Complete	Complete	Complete	Mozilla Firefox before 3.0.11, Thunderbird before 2.0.0.22, and SeaMonkey before 1.1.17 allow remote attackers to cause a denial of service (memory corruption and application crash) or possibly execute arbitrary code via vectors involving "double frame construction."
1020	CVE-2009-1828	399		DoS	2009-05-29	2017-09-28	5.0	None	Remote	Low	Not required	None	None	Partial	Mozilla Firefox 3.0.10 allows remote attackers to cause a denial of service (infinite loop, application hang, and memory consumption) via a KEYGEN element in conjunction with (1) a META element specifying automatic page refresh or (2) a JavaScript onLoad event handler for a BODY element. NOTE: it was later reported that earlier versions are also affected.
1021	CVE-2009-1827	399		DoS	2009-05-29	2017-09-28	5.0	None	Remote	Low	Not required	None	None	Partial	The SVG component in Mozilla Firefox 3.0.4 allows remote attackers to cause a denial of service (application hang) via a large value in the r (aka Radius) attribute of a circle element, related to an "unclamped loop."
1022	CVE-2009-1597	264		Bypass	2009-05-11	2009-05-12	9.3	None	Remote	Medium	Not required	Complete	Complete	Complete	Mozilla Firefox executes DOM calls in response to a javascript: URI in the target attribute of a submit element within a form contained in an inline PDF file, which might allow remote attackers to bypass intended Adobe Acrobat JavaScript restrictions on accessing the document object, as demonstrated by a web site that permits PDF uploads by untrusted users, and therefore has a shared document.domain between the web site and this javascript: URI. NOTE: the researcher reports that Adobe's position is "a PDF file is active content."
1023	CVE-2009-1571	94		Exec Code	2010-02-22	2017-09-28	10.0	None	Remote	Low	Not required	Complete	Complete	Complete	Use-after-free vulnerability in the HTML parser in Mozilla Firefox 3.0.x before 3.0.18 and 3.5.x before 3.5.8, Thunderbird before 3.0.2, and SeaMonkey before 2.0.3 allows remote attackers to execute arbitrary code via unspecified method calls that attempt to access freed objects in low-memory situations.
1024	CVE-2009-1392	94		DoS Exec Code Mem. Corr.	2009-06-12	2017-09-28	9.3	None	Remote	Medium	Not required	Complete	Complete	Complete	The browser engine in Mozilla Firefox 3 before 3.0.11, Thunderbird before 2.0.0.22, and SeaMonkey before 1.1.17 allows remote attackers to cause a denial of service (memory corruption and application crash) or possibly execute arbitrary code via vectors related to (1) nsEventStateManager::GetContentState and nsNativeTheme::CheckBooleanAttr; (2) UnhookTextRunFromFrames and ClearAllTextRunReferences; (3) nsTextFrame::ClearTextRun; (4) IsPercentageAware; (5) PL_DHashTableFinish; (6) nsListBoxBodyFrame::GetNextItemBox; (7) AtomTableClearEntry, related to the atom table, DOM mutation events, and Unicode surrogates; (8) nsHTMLEditor::HideResizers; and (9) nsWindow::SetCursor, related to changing the cursor; and other vectors.
1025	CVE-2009-1313	399		DoS Exec Code Mem. Corr.	2009-04-30	2017-09-28	9.3	None	Remote	Medium	Not required	Complete	Complete	Complete	The nsTextFrame::ClearTextRun function in layout/generic/nsTextFrameThebes.cpp in Mozilla Firefox 3.0.9 allows remote attackers to cause a denial of service (memory corruption) and probably execute arbitrary code via unspecified vectors. NOTE: this vulnerability reportedly exists because of an incorrect fix for CVE-2009-1302.
1026	CVE-2009-1312	16		XSS	2009-04-22	2017-09-28	4.3	None	Remote	Medium	Not required	None	Partial	None	Mozilla Firefox before 3.0.9 and SeaMonkey 1.1.17 do not block javascript: URIs in Refresh headers in HTTP responses, which allows remote attackers to conduct cross-site scripting (XSS) attacks via vectors related to (1) injecting a Refresh header or (2) specifying the content of a Refresh header. NOTE: it was later reported that Firefox 3.6 a1 pre and Mozilla 1.7.x and earlier are also affected.
1027	CVE-2009-1311	200		+Info	2009-04-22	2017-09-28	4.3	None	Remote	Medium	Not required	Partial	None	None	Mozilla Firefox before 3.0.9 and SeaMonkey before 1.1.17 allow user-assisted remote attackers to obtain sensitive information via a web page with an embedded frame, which causes POST data from an outer page to be sent to the inner frame's URL during a SAVEMODE_FILEONLY save of the inner frame.
1028	CVE-2009-1310	79		XSS	2009-04-22	2017-09-28	4.3	None	Remote	Medium	Not required	None	Partial	None	Cross-site scripting (XSS) vulnerability in the MozSearch plugin implementation in Mozilla Firefox before 3.0.9 allows user-assisted remote attackers to inject arbitrary web script or HTML via a javascript: URI in the SearchForm element.
1029	CVE-2009-1309	16		XSS	2009-04-22	2017-09-28	4.3	None	Remote	Medium	Not required	None	Partial	None	Mozilla Firefox before 3.0.9, Thunderbird, and SeaMonkey do not properly implement the Same Origin Policy for (1) XMLHttpRequest, involving a mismatch for a document's principal, and (2) XPCNativeWrapper.toString, involving an incorrect __proto__ scope, which allows remote attackers to conduct cross-site scripting (XSS) attacks and possibly other attacks via a crafted document.
1030	CVE-2009-1308	79		XSS	2009-04-22	2017-09-28	4.3	None	Remote	Medium	Not required	None	Partial	None	Cross-site scripting (XSS) vulnerability in Mozilla Firefox before 3.0.9, Thunderbird, and SeaMonkey allows remote attackers to inject arbitrary web script or HTML via vectors involving XBL JavaScript bindings and remote stylesheets, as exploited in the wild by a March 2009 eBay listing.
1031	CVE-2009-1307	20		Bypass	2009-04-22	2017-09-28	6.8	None	Remote	Medium	Not required	Partial	Partial	Partial	The view-source: URI implementation in Mozilla Firefox before 3.0.9, Thunderbird, and SeaMonkey does not properly implement the Same Origin Policy, which allows remote attackers to (1) bypass crossdomain.xml restrictions and connect to arbitrary web sites via a Flash file; (2) read, create, or modify Local Shared Objects via a Flash file; or (3) bypass unspecified restrictions and render content via vectors involving a jar: URI.
1032	CVE-2009-1306	16		XSS	2009-04-22	2017-09-28	4.3	None	Remote	Medium	Not required	None	Partial	None	The jar: URI implementation in Mozilla Firefox before 3.0.9, Thunderbird, and SeaMonkey does not follow the Content-Disposition header of the inner URI, which allows remote attackers to conduct cross-site scripting (XSS) attacks and possibly other attacks via an uploaded .jar file with a "Content-Disposition: attachment" designation.
1033	CVE-2009-1305	399		DoS Mem. Corr.	2009-04-22	2017-09-28	5.0	None	Remote	Low	Not required	None	None	Partial	The JavaScript engine in Mozilla Firefox before 3.0.9, Thunderbird before 2.0.0.22, and SeaMonkey before 1.1.16 allows remote attackers to cause a denial of service (application crash) and possibly trigger memory corruption via vectors involving JSOP_DEFVAR and properties that lack the JSPROP_PERMANENT attribute.
1034	CVE-2009-1304	399		DoS Mem. Corr.	2009-04-22	2017-09-28	5.0	None	Remote	Low	Not required	None	None	Partial	The JavaScript engine in Mozilla Firefox 3.x before 3.0.9, Thunderbird before 2.0.0.22, and SeaMonkey before 1.1.16 allows remote attackers to cause a denial of service (application crash) and possibly trigger memory corruption via vectors involving (1) js_FindPropertyHelper, related to the definitions of Math and Date; and (2) js_CheckRedeclaration.
1035	CVE-2009-1303	16		DoS Mem. Corr.	2009-04-22	2017-09-28	5.0	None	Remote	Low	Not required	None	None	Partial	The browser engine in Mozilla Firefox before 3.0.9, Thunderbird before 2.0.0.22, and SeaMonkey before 1.1.16 allows remote attackers to cause a denial of service (application crash) and possibly trigger memory corruption via vectors related to nsSVGElement::BindToTree.
1036	CVE-2009-1302	399		DoS Mem. Corr.	2009-04-22	2017-09-28	5.0	None	Remote	Low	Not required	None	None	Partial	The browser engine in Mozilla Firefox 3.x before 3.0.9, Thunderbird before 2.0.0.22, and SeaMonkey before 1.1.16 allows remote attackers to cause a denial of service (application crash) and possibly trigger memory corruption via vectors related to (1) nsAsyncInstantiateEvent::Run, (2) nsStyleContext::Destroy, (3) nsComputedDOMStyle::GetWidth, (4) the xslt_attributeset_ImportSameName.html test case for the XSLT stylesheet compiler, (5) nsXULDocument::SynchronizeBroadcastListener, (6) IsBindingAncestor, (7) PL_DHashTableOperate and nsEditor::EndUpdateViewBatch, and (8) gfxSkipCharsIterator::SetOffsets, and other vectors.
1037	CVE-2009-1232	20		DoS Mem. Corr.	2009-04-02	2017-09-28	4.3	None	Remote	Medium	Not required	None	None	Partial	Mozilla Firefox 3.0.8 and earlier 3.0.x versions allows remote attackers to cause a denial of service (memory corruption) via an XML document composed of a long series of start-tags with no corresponding end-tags. NOTE: it was later reported that 3.0.10 and earlier are also affected.
1038	CVE-2009-1169	399		DoS Exec Code	2009-03-26	2017-09-28	9.3	None	Remote	Medium	Not required	Complete	Complete	Complete	The txMozillaXSLTProcessor::TransformToDoc function in Mozilla Firefox before 3.0.8 and SeaMonkey before 1.1.16 allows remote attackers to cause a denial of service (crash) and possibly execute arbitrary code via an XML file with a crafted XSLT transform.
1039	CVE-2009-1044	399		Exec Code	2009-03-23	2017-09-28	9.3	None	Remote	Medium	Not required	Complete	Complete	Complete	Mozilla Firefox 3.0.7 on Windows 7 allows remote attackers to execute arbitrary code via unknown vectors related to the _moveToEdgeShift XUL tree method, which triggers garbage collection on objects that are still in use, as demonstrated by Nils during a PWN2OWN competition at CanSecWest 2009.
1040	CVE-2009-0821	399		DoS	2009-03-04	2009-03-05	5.0	None	Remote	Low	Not required	None	None	Partial	Mozilla Firefox 2.0.0.20 and earlier allows remote attackers to cause a denial of service (application crash) via nested calls to the window.print function, as demonstrated by a window.print(window.print()) in the onclick attribute of an INPUT element.
1041	CVE-2009-0777	20			2009-03-04	2017-09-28	5.8	None	Remote	Medium	Not required	None	Partial	Partial	Mozilla Firefox before 3.0.7, Thunderbird before 2.0.0.21, and SeaMonkey before 1.1.15 decode invisible characters when they are displayed in the location bar, which causes an incorrect address to be displayed and makes it easier for remote attackers to spoof URLs and conduct phishing attacks.
1042	CVE-2009-0776	200		Bypass +Info	2009-03-04	2017-09-28	7.1	None	Remote	Medium	Not required	Complete	None	None	nsIRDFService in Mozilla Firefox before 3.0.7, Thunderbird before 2.0.0.21, and SeaMonkey before 1.1.15 allows remote attackers to bypass the same-origin policy and read XML data from another domain via a cross-domain redirect.
1043	CVE-2009-0775	399		Exec Code	2009-03-04	2017-09-28	10.0	Admin	Remote	Low	Not required	Complete	Complete	Complete	Double free vulnerability in Mozilla Firefox before 3.0.7, Thunderbird before 2.0.0.21, and SeaMonkey before 1.1.15 allows remote attackers to execute arbitrary code via "cloned XUL DOM elements which were linked as a parent and child," which are not properly handled during garbage collection.
1044	CVE-2009-0774	399		DoS Exec Code	2009-03-04	2017-09-28	9.3	None	Remote	Medium	Not required	Complete	Complete	Complete	The layout engine in Mozilla Firefox 2 and 3 before 3.0.7, Thunderbird before 2.0.0.21, and SeaMonkey 1.1.15 allows remote attackers to cause a denial of service (crash) and possibly execute arbitrary code via vectors related to gczeal, a different vulnerability than CVE-2009-0773.
1045	CVE-2009-0773	399		DoS Exec Code Mem. Corr.	2009-03-04	2017-09-28	10.0	Admin	Remote	Low	Not required	Complete	Complete	Complete	The JavaScript engine in Mozilla Firefox before 3.0.7, Thunderbird before 2.0.0.21, and SeaMonkey 1.1.15 allows remote attackers to cause a denial of service (crash) and possibly execute arbitrary code via (1) a splice of an array that contains "some non-set elements," which causes jsarray.cpp to pass an incorrect argument to the ResizeSlots function, which triggers memory corruption; (2) vectors related to js_DecompileValueGenerator, jsopcode.cpp, __defineSetter__, and watch, which triggers an assertion failure or a segmentation fault; and (3) vectors related to gczeal, __defineSetter__, and watch, which triggers a hang.
1046	CVE-2009-0772	399		DoS Exec Code Mem. Corr.	2009-03-04	2017-09-28	9.3	None	Remote	Medium	Not required	Complete	Complete	Complete	The layout engine in Mozilla Firefox 2 and 3 before 3.0.7, Thunderbird before 2.0.0.21, and SeaMonkey 1.1.15 allows remote attackers to cause a denial of service (crash) and possibly execute arbitrary code via vectors related to nsCSSStyleSheet::GetOwnerNode, events, and garbage collection, which triggers memory corruption.
1047	CVE-2009-0771	399		DoS Exec Code Mem. Corr.	2009-03-04	2017-09-28	10.0	Admin	Remote	Low	Not required	Complete	Complete	Complete	The layout engine in Mozilla Firefox before 3.0.7, Thunderbird before 2.0.0.21, and SeaMonkey 1.1.15 allows remote attackers to cause a denial of service (crash) and possibly execute arbitrary code via certain vectors that trigger memory corruption and assertion failures.
1048	CVE-2009-0733	119		Exec Code Overflow	2009-03-23	2017-09-28	9.3	None	Remote	Medium	Not required	Complete	Complete	Complete	Multiple stack-based buffer overflows in the ReadSetOfCurves function in LittleCMS (aka lcms or liblcms) before 1.18beta2, as used in Firefox 3.1beta, OpenJDK, and GIMP, allow context-dependent attackers to execute arbitrary code via a crafted image file associated with a large integer value for the (1) input or (2) output channel, related to the ReadLUT_A2B and ReadLUT_B2A functions.
1049	CVE-2009-0723	189		Exec Code Overflow	2009-03-23	2017-09-28	9.3	None	Remote	Medium	Not required	Complete	Complete	Complete	Multiple integer overflows in LittleCMS (aka lcms or liblcms) before 1.18beta2, as used in Firefox 3.1beta, OpenJDK, and GIMP, allow context-dependent attackers to execute arbitrary code via a crafted image file that triggers a heap-based buffer overflow. NOTE: some of these details are obtained from third party information.
1050	CVE-2009-0689	119		DoS Exec Code Overflow	2009-07-01	2017-09-28	6.8	User	Remote	Medium	Not required	Partial	Partial	Partial	Array index error in the (1) dtoa implementation in dtoa.c (aka pdtoa.c) and the (2) gdtoa (aka new dtoa) implementation in gdtoa/misc.c in libc, as used in multiple operating systems and products including in FreeBSD 6.4 and 7.2, NetBSD 5.0, OpenBSD 4.5, Mozilla Firefox 3.0.x before 3.0.15 and 3.5.x before 3.5.4, K-Meleon 1.5.3, SeaMonkey 1.1.8, and other products, allows context-dependent attackers to cause a denial of service (application crash) and possibly execute arbitrary code via a large precision value in the format argument to a printf function, which triggers incorrect memory allocation and a heap-based buffer overflow during conversion to a floating-point number.
