#	CVE ID	CWE ID	# of Exploits	Vulnerability Type(s)	Publish Date	Update Date	Score	Gained Access Level	Access	Complexity	Authentication	Conf.	Integ.	Avail.
1301	CVE-2006-1942				2006-04-20	2017-07-19	5.1	User	Remote	High	Not required	Partial	Partial	Partial	Mozilla Firefox 1.5.0.2 and possibly other versions before 1.5.0.4, Netscape 8.1, 8.0.4, and 7.2, and K-Meleon 0.9.13 allows user-assisted remote attackers to open local files via a web page with an IMG element containing a SRC attribute with a non-image file:// URL, then tricking the user into selecting View Image for the broken image, as demonstrated using a .wma file to launch Windows Media Player, or by referencing an "alternate web page."
1302	CVE-2006-1790	399		DoS Exec Code Mem. Corr.	2006-04-14	2017-10-10	10.0	None	Remote	Low	Not required	Complete	Complete	Complete	A regression fix in Mozilla Firefox 1.0.7 allows remote attackers to cause a denial of service (crash) and possibly execute arbitrary code via the InstallTrigger.install method, which leads to memory corruption.
1303	CVE-2006-1742			Mem. Corr.	2006-04-14	2017-10-10	5.0	None	Remote	Low	Not required	None	Partial	None	The JavaScript engine in Mozilla Firefox and Thunderbird 1.x before 1.5 and 1.0.x before 1.0.8, Mozilla Suite before 1.7.13, and SeaMonkey before 1.0 does not properly handle temporary variables that are not garbage collected, which might allow remote attackers to trigger operations on freed memory and cause memory corruption.
1304	CVE-2006-1741	79		XSS	2006-04-14	2017-10-10	4.3	None	Remote	Medium	Not required	None	Partial	None	Mozilla Firefox 1.x before 1.5 and 1.0.x before 1.0.8, Mozilla Suite before 1.7.13, and SeaMonkey before 1.0 allows remote attackers to inject arbitrary Javascript into other sites by (1) "using a modal alert to suspend an event handler while a new page is being loaded", (2) using eval(), and using certain variants involving (3) "new Script;" and (4) using window.__proto__ to extend eval, aka "cross-site JavaScript injection".
1305	CVE-2006-1740				2006-04-14	2017-10-10	2.6	None	Remote	High	Not required	None	Partial	None	Mozilla Firefox 1.x before 1.5 and 1.0.x before 1.0.8, Mozilla Suite before 1.7.13, and SeaMonkey before 1.0 allows remote attackers to spoof secure site indicators such as the locked icon by opening the trusted site in a popup window, then changing the location to a malicious site.
1306	CVE-2006-1739	119		DoS Exec Code Overflow	2006-04-14	2017-10-10	9.3	None	Remote	Medium	Not required	Complete	Complete	Complete	The CSS border-rendering code in Mozilla Firefox and Thunderbird 1.x before 1.5 and 1.0.x before 1.0.8, Mozilla Suite before 1.7.13, and SeaMonkey before 1.0 allows remote attackers to cause a denial of service (crash) and possibly execute arbitrary code via certain Cascading Style Sheets (CSS) that causes an out-of-bounds array write and buffer overflow.
1307	CVE-2006-1738			DoS	2006-04-14	2017-10-10	5.0	None	Remote	Low	Not required	None	None	Partial	Unspecified vulnerability in Mozilla Firefox and Thunderbird 1.x before 1.5 and 1.0.x before 1.0.8, Mozilla Suite before 1.7.13, and SeaMonkey before 1.0 allows remote attackers to cause a denial of service (crash) by changing the (1) -moz-grid and (2) -moz-grid-group display styles.
1308	CVE-2006-1737	189		DoS Exec Code Overflow	2006-04-14	2017-10-10	9.3	Admin	Remote	Medium	Not required	Complete	Complete	Complete	Integer overflow in Mozilla Firefox and Thunderbird 1.x before 1.5 and 1.0.x before 1.0.8, Mozilla Suite before 1.7.13, and SeaMonkey before 1.0 allows remote attackers to cause a denial of service (crash) and possibly execute arbitrary bytecode via JavaScript with a large regular expression.
1309	CVE-2006-1736				2006-04-14	2017-10-10	2.6	None	Remote	High	Not required	None	Partial	None	Mozilla Firefox 1.x before 1.5 and 1.0.x before 1.0.8, Mozilla Suite before 1.7.13, and SeaMonkey before 1.0 allows remote attackers to trick users into downloading and saving an executable file via an image that is overlaid by a transparent image link that points to the executable, which causes the executable to be saved when the user clicks the "Save image as..." option. NOTE: this attack is made easier due to a GUI truncation issue that prevents the user from seeing the malicious extension when there is extra whitespace in the filename.
1310	CVE-2006-1735	264		Exec Code	2006-04-14	2017-10-10	9.3	Admin	Remote	Medium	Not required	Complete	Complete	Complete	Mozilla Firefox and Thunderbird 1.x before 1.5 and 1.0.x before 1.0.8, Mozilla Suite before 1.7.13, and SeaMonkey before 1.0 allows remote attackers to execute arbitrary code by using an eval in an XBL method binding (XBL.method.eval) to create Javascript functions that are compiled with extra privileges.
1311	CVE-2006-1734			Exec Code	2006-04-14	2017-10-10	6.8	User	Remote	Medium	Not required	Partial	Partial	Partial	Mozilla Firefox and Thunderbird 1.x before 1.5 and 1.0.x before 1.0.8, Mozilla Suite before 1.7.13, and SeaMonkey before 1.0 allows remote attackers to execute arbitrary code by using the Object.watch method to access the "clone parent" internal function.
1312	CVE-2006-1733	264		Exec Code	2006-04-14	2017-10-10	6.8	User	Remote	Medium	Not required	Partial	Partial	Partial	Mozilla Firefox and Thunderbird 1.x before 1.5 and 1.0.x before 1.0.8, Mozilla Suite before 1.7.13, and SeaMonkey before 1.0 does not properly protect the compilation scope of privileged built-in XBL bindings, which allows remote attackers to execute arbitrary code via the (1) valueOf.call or (2) valueOf.apply methods of an XBL binding, or (3) "by inserting an XBL method into the DOM's document.body prototype chain."
1313	CVE-2006-1732			XSS Bypass	2006-04-14	2017-10-10	4.3	None	Remote	Medium	Not required	None	Partial	None	Unspecified vulnerability in Mozilla Firefox and Thunderbird 1.x before 1.5 and 1.0.x before 1.0.8, Mozilla Suite before 1.7.13, and SeaMonkey before 1.0 allows remote attackers to bypass same-origin protections and conduct cross-site scripting (XSS) attacks via unspecified vectors involving the window.controllers array.
1314	CVE-2006-1731	79		XSS	2006-04-14	2017-10-10	4.3	None	Remote	Medium	Not required	None	Partial	None	Mozilla Firefox and Thunderbird 1.x before 1.5 and 1.0.x before 1.0.8, Mozilla Suite before 1.7.13, and SeaMonkey before 1.0 returns the Object class prototype instead of the global window object when (1) .valueOf.call or (2) .valueOf.apply are called without any arguments, which allows remote attackers to conduct cross-site scripting (XSS) attacks.
1315	CVE-2006-1730	189		Exec Code Overflow	2006-04-14	2017-10-10	9.3	Admin	Remote	Medium	Not required	Complete	Complete	Complete	Integer overflow in Mozilla Firefox and Thunderbird 1.x before 1.5.0.2 and 1.0.x before 1.0.8, Mozilla Suite before 1.7.13, and SeaMonkey before 1.0.1 allows remote attackers to execute arbitrary code via a large number in the CSS letter-spacing property that leads to a heap-based buffer overflow.
1316	CVE-2006-1729	20			2006-04-14	2017-10-10	4.3	None	Remote	Medium	Not required	Partial	None	None	Mozilla Firefox 1.x before 1.5.0.2 and 1.0.x before 1.0.8, Mozilla Suite before 1.7.13, and SeaMonkey before 1.0.1 allows remote attackers to read arbitrary files by (1) inserting the target filename into a text box, then turning that box into a file upload control, or (2) changing the type of the input control that is associated with an event handler.
1317	CVE-2006-1728			Exec Code	2006-04-14	2017-10-10	9.3	Admin	Remote	Medium	Not required	Complete	Complete	Complete	Unspecified vulnerability in Mozilla Firefox and Thunderbird 1.x before 1.5.0.2 and 1.0.x before 1.0.8, Mozilla Suite before 1.7.13, and SeaMonkey before 1.0.1 allows remote attackers to execute arbitrary code via unknown vectors related to the crypto.generateCRMFRequest method.
1318	CVE-2006-1727			+Priv	2006-04-14	2017-10-10	7.6	Admin	Remote	High	Not required	Complete	Complete	Complete	Unspecified vulnerability in Mozilla Firefox and Thunderbird 1.x before 1.5.0.2 and 1.0.x before 1.0.8, Mozilla Suite before 1.7.13, and SeaMonkey before 1.0.1 allows remote attackers to gain chrome privileges via multiple attack vectors related to the use of XBL scripts with "Print Preview".
1319	CVE-2006-1726	264		Exec Code Bypass	2006-04-14	2017-10-10	9.3	None	Remote	Medium	Not required	Complete	Complete	Complete	Unspecified vulnerability in Firefox and Thunderbird 1.5 before 1.5.0.2, and SeaMonkey before 1.0.1, allows remote attackers to bypass the js_ValueToFunctionObject check and execute arbitrary code via unknown vectors involving setTimeout and Firefox' ForEach method.
1320	CVE-2006-1725	264			2006-04-14	2017-10-10	2.6	None	Remote	High	Not required	None	Partial	None	Mozilla Firefox 1.5 before 1.5.0.2 and SeaMonkey before 1.0.1 causes certain windows to become translucent due to an interaction between XUL content windows and the history mechanism, which might allow user-assisted remote attackers to trick users into executing arbitrary code.
1321	CVE-2006-1724			DoS Exec Code	2006-04-14	2017-10-10	7.5	User	Remote	Low	Not required	Partial	Partial	Partial	Unspecified vulnerability in Firefox and Thunderbird before 1.5.0.2, 1.0.x before 1.0.8, Mozilla Suite before 1.7.13, and SeaMonkey before 1.0.1 allows remote attackers to cause a denial of service (crash) and possibly execute arbitrary code via attack vectors related to DHTML.
1322	CVE-2006-1723			DoS Exec Code	2006-04-14	2017-10-10	7.5	User	Remote	Low	Not required	Partial	Partial	Partial	Unspecified vulnerability in Firefox and Thunderbird before 1.5.0.2, and SeaMonkey before 1.0.1, allows remote attackers to cause a denial of service (crash) and possibly execute arbitrary code via unknown attack vectors related to DHTML. NOTE: due to the lack of sufficient public details from the vendor as of 20060413, it is unclear how CVE-2006-1529, CVE-2006-1530, CVE-2006-1531, and CVE-2006-1723 are different.
1323	CVE-2006-1650				2006-04-06	2017-07-19	5.0	None	Remote	Low	Not required	None	Partial	None	Firefox 1.5.0.1 allows remote attackers to spoof the address bar and possibly conduct phishing attacks by re-opening the window to a malicious Shockwave Flash application, then changing the window location back to a trusted URL while the Flash application is still loading. NOTE: a followup was unable to replicate this issue.
1324	CVE-2006-1531			DoS Exec Code	2006-04-14	2017-10-10	7.5	User	Remote	Low	Not required	Partial	Partial	Partial	Unspecified vulnerability in Firefox and Thunderbird before 1.5.0.2, and SeaMonkey before 1.0.1, allows remote attackers to cause a denial of service (crash) and possibly execute arbitrary code via unknown attack vectors related to DHTML. NOTE: due to the lack of sufficient public details from the vendor as of 20060413, it is unclear how CVE-2006-1529, CVE-2006-1530, CVE-2006-1531, and CVE-2006-1723 are different.
1325	CVE-2006-1530			DoS Exec Code	2006-04-14	2017-10-10	7.5	User	Remote	Low	Not required	Partial	Partial	Partial	Unspecified vulnerability in Firefox and Thunderbird before 1.5.0.2, and SeaMonkey before 1.0.1, allows remote attackers to cause a denial of service (crash) and possibly execute arbitrary code via unknown attack vectors related to DHTML. NOTE: due to the lack of sufficient public details from the vendor as of 20060413, it is unclear how CVE-2006-1529, CVE-2006-1530, CVE-2006-1531, and CVE-2006-1723 are different.
1326	CVE-2006-1529			DoS Exec Code	2006-04-14	2017-10-10	7.5	User	Remote	Low	Not required	Partial	Partial	Partial	Unspecified vulnerability in Firefox and Thunderbird before 1.5.0.2, and SeaMonkey before 1.0.1, allows remote attackers to cause a denial of service (crash) and possibly execute arbitrary code via unknown attack vectors related to DHTML. NOTE: due to the lack of sufficient public details from the vendor as of 20060413, it is unclear how CVE-2006-1529, CVE-2006-1530, CVE-2006-1531, and CVE-2006-1723 are different.
1327	CVE-2006-1273			DoS	2006-03-19	2008-11-15	7.8	None	Remote	Low	Not required	None	None	Complete	** DISPUTED ** Mozilla Firefox 1.0.7 and 1.5.0.1 allows remote attackers to cause a denial of service (crash) via an HTML tag with a large number of script action handlers such as onload and onmouseover, which triggers the crash when the user views the page source. NOTE: Red Hat has disputed this issue, suggesting that "It is likely the reporter was running the IE Tab extension," and Mozilla also confirmed that this is not an issue in Firefox itself.
1328	CVE-2006-0749	399		DoS Exec Code Mem. Corr.	2006-04-14	2017-10-10	9.3	Admin	Remote	Medium	Not required	Complete	Complete	Complete	nsHTMLContentSink.cpp in Mozilla Firefox and Thunderbird 1.x before 1.5 and 1.0.x before 1.0.8, Mozilla Suite before 1.7.13, and SeaMonkey before 1.0 allows remote attackers to cause a denial of service (crash) and possibly execute arbitrary code via unknown vectors involving a "particular sequence of HTML tags" that leads to memory corruption.
1329	CVE-2006-0748	399		Exec Code	2006-04-14	2017-10-10	9.3	None	Remote	Medium	Not required	Complete	Complete	Complete	Mozilla Firefox and Thunderbird 1.x before 1.5.0.2 and 1.0.x before 1.0.8, Mozilla Suite before 1.7.13, and SeaMonkey before 1.0.1 allows remote attackers to execute arbitrary code via "an invalid and non-sensical ordering of table-related tags" that results in a negative array index.
1330	CVE-2006-0496			XSS	2006-01-31	2017-07-19	4.3	None	Remote	Medium	Not required	None	Partial	None	Cross-site scripting (XSS) vulnerability in Mozilla 1.7.12 and possibly earlier, Mozilla Firefox 1.0.7 and possibly earlier, and Netscape 8.1 and possibly earlier, allows remote attackers to inject arbitrary web script or HTML via the -moz-binding (Cascading Style Sheets) CSS property, which does not require that the style sheet have the same origin as the web page, as demonstrated by the compromise of a large number of LiveJournal accounts.
1331	CVE-2006-0299				2006-02-02	2017-10-10	6.4	None	Remote	Low	Not required	Partial	Partial	None	The E4X implementation in Mozilla Firefox before 1.5.0.1, Thunderbird 1.5 if running Javascript in mail, and SeaMonkey before 1.0 exposes the internal "AnyName" object to external interfaces, which allows multiple cooperating domains to exchange information in violation of the same origin restrictions.
1332	CVE-2006-0298	20		DoS	2006-02-02	2017-10-10	5.8	None	Remote	Medium	Not required	Partial	None	Partial	The XML parser in Mozilla Firefox before 1.5.0.1 and SeaMonkey before 1.0 allows remote attackers to cause a denial of service (crash) and possibly read sensitive data via unknown attack vectors that trigger an out-of-bounds read.
1333	CVE-2006-0297			Exec Code Overflow	2006-02-02	2017-10-10	5.1	User	Remote	High	Not required	Partial	Partial	Partial	Multiple integer overflows in Mozilla Firefox 1.5, Thunderbird 1.5 if Javascript is enabled in mail, and SeaMonkey before 1.0 might allow remote attackers to execute arbitrary code via the (1) EscapeAttributeValue in jsxml.c for E4X, (2) nsSVGCairoSurface::Init in SVG, and (3) nsCanvasRenderingContext2D.cpp in Canvas.
1334	CVE-2006-0296				2006-02-02	2017-10-10	5.0	None	Remote	Low	Not required	None	Partial	None	The XULDocument.persist function in Mozilla, Firefox before 1.5.0.1, and SeaMonkey before 1.0 does not validate the attribute name, which allows remote attackers to execute arbitrary Javascript by injecting RDF data into the user's localstore.rdf file.
1335	CVE-2006-0295			Exec Code Mem. Corr.	2006-02-02	2017-10-10	5.1	User	Remote	High	Not required	Partial	Partial	Partial	Mozilla Firefox 1.5, Thunderbird 1.5 if Javascript is enabled in mail, and SeaMonkey before 1.0 might allow remote attackers to execute arbitrary code via the QueryInterface method of the built-in Location and Navigator objects, which leads to memory corruption.
1336	CVE-2006-0294			Exec Code	2006-02-02	2017-10-10	7.5	User	Remote	Low	Not required	Partial	Partial	Partial	Mozilla Firefox before 1.5.0.1, Thunderbird 1.5 if running Javascript in mail, and SeaMonkey before 1.0 allow remote attackers to execute arbitrary code by changing an element's style from position:relative to position:static, which causes Gecko to operate on freed memory.
1337	CVE-2006-0293			DoS Exec Code Mem. Corr.	2006-02-02	2017-10-10	7.5	User	Remote	Low	Not required	Partial	Partial	Partial	The function allocation code (js_NewFunction in jsfun.c) in Firefox 1.5 allows attackers to cause a denial of service (memory corruption) and possibly execute arbitrary code via user-defined methods that trigger garbage collection in a way that operates on freed objects.
1338	CVE-2006-0292			DoS Exec Code	2006-02-02	2017-10-10	7.5	User	Remote	Low	Not required	Partial	Partial	Partial	The Javascript interpreter (jsinterp.c) in Mozilla and Firefox before 1.5.1 does not properly dereference objects, which allows remote attackers to cause a denial of service (crash) or execute arbitrary code via unknown attack vectors related to garbage collection.
1339	CVE-2005-4809				2005-12-31	2017-07-19	5.0	None	Remote	Low	Not required	None	Partial	None	Mozilla Firefox 1.0.1 and possibly other versions, including Mozilla and Thunderbird, allows remote attackers to spoof the URL in the Status Bar via an A HREF tag that contains a TABLE tag that contains another A tag.
1340	CVE-2005-4720			DoS	2005-12-31	2008-09-05	5.0	None	Remote	Low	Not required	None	None	Partial	Mozilla Firefox 1.0.7 and earlier on Linux allows remote attackers to cause a denial of service (client crash) via an IFRAME element with a large value of the WIDTH attribute, which triggers a problem related to representation of floating-point numbers, leading to an infinite loop of widget resizes and a corresponding large number of function calls on the stack.
1341	CVE-2005-4685				2005-12-31	2017-07-19	6.4	None	Remote	Low	Not required	Partial	Partial	None	Firefox and Mozilla can associate a cookie with multiple domains when the DNS resolver has a non-root domain in its search list, which allows remote attackers to trick a user into accepting a cookie for a hostname formed via search-list expansion of the hostname entered by the user, or steal a cookie for an expanded hostname, as demonstrated by an attacker who operates an ap1.com Internet web site to steal cookies associated with an ap1.com.example.com intranet web site.
1342	CVE-2005-4134			DoS Overflow	2005-12-09	2017-10-10	5.0	None	Remote	Low	Not required	None	None	Partial	Mozilla Firefox 1.5, Netscape 8.0.4 and 7.2, and K-Meleon before 0.9.12 allows remote attackers to cause a denial of service (CPU consumption and delayed application startup) via a web site with a large title, which is recorded in history.dat but not processed efficiently during startup. NOTE: despite initial reports, the Mozilla vendor does not believe that this issue can be used to trigger a crash or buffer overflow in Firefox. Also, it has been independently reported that Netscape 8.1 does not have this issue.
1343	CVE-2005-3089			DoS	2005-09-28	2017-10-10	2.6	None	Remote	High	Not required	None	None	Partial	Firefox 1.0.6 allows attackers to cause a denial of service (crash) via a Proxy Auto-Config (PAC) script that uses an eval statement. NOTE: it is not clear whether an untrusted party has any role in triggering this issue, so it might not be a vulnerability.
1344	CVE-2005-2968			Exec Code	2005-09-20	2017-10-10	7.5	User	Remote	Low	Not required	Partial	Partial	Partial	Firefox 1.0.6 and Mozilla 1.7.10 allows attackers to execute arbitrary commands via shell metacharacters in a URL that is provided to the browser on the command line, which is sent unfiltered to bash.
1345	CVE-2005-2871			DoS Exec Code Overflow	2005-09-09	2017-07-10	7.5	User	Remote	Low	Not required	Partial	Partial	Partial	Buffer overflow in the International Domain Name (IDN) support in Mozilla Firefox 1.0.6 and earlier, and Netscape 8.0.3.3 and 7.2, allows remote attackers to cause a denial of service (crash) and possibly execute arbitrary code via a hostname with all "soft" hyphens (character 0xAD), which is not properly handled by the NormalizeIDN call in nsStandardURL::BuildNormalizedSpec.
1346	CVE-2005-2707				2005-09-23	2017-10-10	5.0	None	Remote	Low	Not required	None	Partial	None	Firefox before 1.0.7 and Mozilla Suite before 1.7.12 allows remote attackers to spawn windows without user interface components such as the address and status bar, which could be used to conduct spoofing or phishing attacks.
1347	CVE-2005-2706				2005-09-23	2017-10-10	6.4	None	Remote	Low	Not required	Partial	Partial	None	Firefox before 1.0.7 and Mozilla before Suite 1.7.12 allows remote attackers to execute Javascript with chrome privileges via an about: page such as about:mozilla.
1348	CVE-2005-2705			Exec Code Overflow	2005-09-23	2017-10-10	7.5	User	Remote	Low	Not required	Partial	Partial	Partial	Integer overflow in the JavaScript engine in Firefox before 1.0.7 and Mozilla Suite before 1.7.12 might allow remote attackers to execute arbitrary code.
1349	CVE-2005-2704				2005-09-23	2017-10-10	5.0	None	Remote	Low	Not required	None	Partial	None	Firefox before 1.0.7 and Mozilla Suite before 1.7.12 allows remote attackers to spoof DOM objects via an XBL control that implements an internal XPCOM interface.
1350	CVE-2005-2703	94			2005-09-23	2017-10-10	5.0	None	Remote	Low	Not required	None	Partial	None	Firefox before 1.0.7 and Mozilla Suite before 1.7.12 allows remote attackers to modify HTTP headers of XML HTTP requests via XMLHttpRequest, and possibly use the client to exploit vulnerabilities in servers or proxies, including HTTP request smuggling and HTTP request splitting.
