#	CVE ID	CWE ID	# of Exploits	Vulnerability Type(s)	Publish Date	Update Date	Score	Gained Access Level	Access	Complexity	Authentication	Conf.	Integ.	Avail.
901	CVE-2010-1199	189	1	Exec Code Overflow	2010-06-24	2017-09-18	9.3	None	Remote	Medium	Not required	Complete	Complete	Complete	Integer overflow in the XSLT node sorting implementation in Mozilla Firefox 3.5.x before 3.5.10 and 3.6.x before 3.6.4, Thunderbird before 3.0.5, and SeaMonkey before 2.0.5 allows remote attackers to execute arbitrary code via a large text value for a node.
902	CVE-2010-1198	399		Exec Code	2010-06-24	2017-09-18	9.3	None	Remote	Medium	Not required	Complete	Complete	Complete	Use-after-free vulnerability in Mozilla Firefox 3.5.x before 3.5.10 and 3.6.x before 3.6.4, and SeaMonkey before 2.0.5, allows remote attackers to execute arbitrary code via vectors involving multiple plugin instances.
903	CVE-2010-1197	79		XSS	2010-06-24	2017-09-18	4.3	None	Remote	Medium	Not required	None	Partial	None	Mozilla Firefox 3.5.x before 3.5.10 and 3.6.x before 3.6.4, and SeaMonkey before 2.0.5, does not properly handle situations in which both "Content-Disposition: attachment" and "Content-Type: multipart" are present in HTTP headers, which allows remote attackers to conduct cross-site scripting (XSS) attacks via an uploaded HTML document.
904	CVE-2010-1196	189		Exec Code Overflow	2010-06-24	2017-09-18	9.3	None	Remote	Medium	Not required	Complete	Complete	Complete	Integer overflow in the nsGenericDOMDataNode::SetTextInternal function in Mozilla Firefox 3.5.x before 3.5.10 and 3.6.x before 3.6.4, Thunderbird before 3.0.5, and SeaMonkey before 2.0.5 allows remote attackers to execute arbitrary code via a DOM node with a long text value that triggers a heap-based buffer overflow.
905	CVE-2010-1125	200		+Info	2010-03-26	2017-09-18	5.8	None	Remote	Medium	Not required	Partial	Partial	None	The JavaScript implementation in Mozilla Firefox 3.x before 3.5.10 and 3.6.x before 3.6.4, and SeaMonkey before 2.0.5, allows remote attackers to send selected keystrokes to a form field in a hidden frame, instead of the intended form field in a visible frame, via certain calls to the focus method.
906	CVE-2010-1122	119		DoS Overflow Mem. Corr.	2010-03-25	2017-09-18	10.0	None	Remote	Low	Not required	Complete	Complete	Complete	Unspecified vulnerability in Mozilla Firefox 3.5.x through 3.5.8 allows remote attackers to cause a denial of service (memory corruption and application crash) and possibly have unknown other impact via vectors that might involve compressed data, a different vulnerability than CVE-2010-1028.
907	CVE-2010-1121	94		Exec Code	2010-03-25	2017-09-18	10.0	None	Remote	Low	Not required	Complete	Complete	Complete	Mozilla Firefox 3.6.x before 3.6.3 does not properly manage the scopes of DOM nodes that are moved from one document to another, which allows remote attackers to conduct use-after-free attacks and execute arbitrary code via unspecified vectors involving improper interaction with garbage collection, as demonstrated by Nils during a Pwn2Own competition at CanSecWest 2010.
908	CVE-2010-1028	189		Exec Code Overflow	2010-03-19	2017-09-18	9.3	None	Remote	Medium	Not required	Complete	Complete	Complete	Integer overflow in the decompression functionality in the Web Open Fonts Format (WOFF) decoder in Mozilla Firefox 3.6 before 3.6.2 and 3.7 before 3.7 alpha 3 allows remote attackers to execute arbitrary code via a crafted WOFF file that triggers a buffer overflow, as demonstrated by the vd_ff module in VulnDisco 9.0.
909	CVE-2010-0654	200		+Info	2010-02-18	2017-09-18	4.3	None	Remote	Medium	Not required	Partial	None	None	Mozilla Firefox 3.5.x before 3.5.11 and 3.6.x before 3.6.7, Thunderbird 3.0.x before 3.0.6 and 3.1.x before 3.1.1, and SeaMonkey before 2.0.6 permit cross-origin loading of CSS stylesheets even when the stylesheet download has an incorrect MIME type and the stylesheet document is malformed, which allows remote attackers to obtain sensitive information via a crafted document.
910	CVE-2010-0648	200		+Info	2010-02-18	2017-09-18	4.3	None	Remote	Medium	Not required	Partial	None	None	Mozilla Firefox, possibly before 3.6, allows remote attackers to discover a redirect's target URL, for the session of a specific user of a web site, by placing the site's URL in the HREF attribute of a stylesheet LINK element, and then reading the document.styleSheets[0].href property value, related to an IFRAME element.
911	CVE-2010-0220	399		DoS	2010-01-07	2017-09-18	5.0	None	Remote	Low	Not required	None	None	Partial	The nsObserverList::FillObserverArray function in xpcom/ds/nsObserverList.cpp in Mozilla Firefox before 3.5.7 allows remote attackers to cause a denial of service (application crash) via a crafted web site that triggers memory consumption and an accompanying Low Memory alert dialog, and also triggers attempted removal of an observer from an empty observers array.
912	CVE-2010-0183	399		Exec Code	2010-06-24	2017-09-18	9.3	None	Remote	Medium	Not required	Complete	Complete	Complete	Use-after-free vulnerability in the nsCycleCollector::MarkRoots function in Mozilla Firefox 3.5.x before 3.5.10 and SeaMonkey before 2.0.5 allows remote attackers to execute arbitrary code via a crafted HTML document, related to an improper frame construction process for menus.
913	CVE-2010-0182	20		Bypass	2010-04-05	2017-09-18	4.3	None	Remote	Medium	Not required	None	Partial	None	The XMLDocument::load function in Mozilla Firefox before 3.5.9 and 3.6.x before 3.6.2, Thunderbird before 3.0.4, and SeaMonkey before 2.0.4 does not perform the expected nsIContentPolicy checks during loading of content by XML documents, which allows attackers to bypass intended access restrictions via crafted content.
914	CVE-2010-0181	20		DoS	2010-04-05	2017-09-18	4.3	None	Remote	Medium	Not required	None	None	Partial	Mozilla Firefox before 3.5.9 and 3.6.x before 3.6.2, and SeaMonkey before 2.0.4, executes a mail application in situations where an IMG element has a SRC attribute that is a redirect to a mailto: URL, which allows remote attackers to cause a denial of service (excessive application launches) via an HTML document with many images.
915	CVE-2010-0179	94			2010-04-05	2017-09-18	5.1	None	Remote	High	Not required	Partial	Partial	Partial	Mozilla Firefox before 3.0.19 and 3.5.x before 3.5.8, and SeaMonkey before 2.0.3, when the XMLHttpRequestSpy module in the Firebug add-on is used, does not properly handle interaction between the XMLHttpRequestSpy object and chrome privileged objects, which allows remote attackers to execute arbitrary JavaScript via a crafted HTTP response.
916	CVE-2010-0178	94			2010-04-05	2017-09-18	7.6	None	Remote	High	Not required	Complete	Complete	Complete	Mozilla Firefox before 3.0.19, 3.5.x before 3.5.9, and 3.6.x before 3.6.2, and SeaMonkey before 2.0.4, does not prevent applets from interpreting mouse clicks as drag-and-drop actions, which allows remote attackers to execute arbitrary JavaScript with Chrome privileges by loading a chrome: URL and then loading a javascript: URL.
917	CVE-2010-0177	399		DoS Exec Code	2010-04-05	2017-09-18	9.3	None	Remote	Medium	Not required	Complete	Complete	Complete	Mozilla Firefox before 3.0.19, 3.5.x before 3.5.9, and 3.6.x before 3.6.2, and SeaMonkey before 2.0.4, frees the contents of the window.navigator.plugins array while a reference to an array element is still active, which allows remote attackers to execute arbitrary code or cause a denial of service (application crash) via unspecified vectors, related to a "dangling pointer vulnerability."
918	CVE-2010-0176	399		Exec Code	2010-04-05	2017-09-18	9.3	None	Remote	Medium	Not required	Complete	Complete	Complete	Mozilla Firefox before 3.0.19, 3.5.x before 3.5.9, and 3.6.x before 3.6.2; Thunderbird before 3.0.4; and SeaMonkey before 2.0.4 do not properly manage reference counts for option elements in a XUL tree optgroup, which might allow remote attackers to execute arbitrary code via unspecified vectors that trigger access to deleted elements, related to a "dangling pointer vulnerability."
919	CVE-2010-0175	399		DoS Exec Code	2010-04-05	2017-09-18	9.3	None	Remote	Medium	Not required	Complete	Complete	Complete	Use-after-free vulnerability in the nsTreeSelection implementation in Mozilla Firefox before 3.0.19 and 3.5.x before 3.5.9, Thunderbird before 3.0.4, and SeaMonkey before 2.0.4 allows remote attackers to execute arbitrary code or cause a denial of service (application crash) via unspecified vectors that trigger a call to the handler for the select event for XUL tree items.
920	CVE-2010-0174			DoS Exec Code Mem. Corr.	2010-04-05	2017-09-18	10.0	None	Remote	Low	Not required	Complete	Complete	Complete	Multiple unspecified vulnerabilities in the browser engine in Mozilla Firefox before 3.0.19, 3.5.x before 3.5.9, and 3.6.x before 3.6.2; Thunderbird before 3.0.4; and SeaMonkey before 2.0.4 allow remote attackers to cause a denial of service (memory corruption and application crash) or possibly execute arbitrary code via unknown vectors.
921	CVE-2010-0173			DoS Exec Code Mem. Corr.	2010-04-05	2017-09-18	9.3	None	Remote	Medium	Not required	Complete	Complete	Complete	Multiple unspecified vulnerabilities in the browser engine in Mozilla Firefox before 3.5.9 and 3.6.x before 3.6.2, Thunderbird before 3.0.4, and SeaMonkey before 2.0.4 allow remote attackers to cause a denial of service (memory corruption and application crash) or possibly execute arbitrary code via unknown vectors.
922	CVE-2010-0172				2010-03-25	2017-09-18	4.3	None	Remote	Medium	Not required	Partial	None	None	toolkit/components/passwordmgr/src/nsLoginManagerPrompter.js in the asynchronous Authorization Prompt implementation in Mozilla Firefox 3.6 before 3.6.2 does not properly handle concurrent authorization requests from multiple web sites, which might allow remote web servers to spoof an authorization dialog and capture credentials by demanding HTTP authentication in opportunistic circumstances.
923	CVE-2010-0171	79		XSS	2010-03-25	2017-09-18	4.3	None	Remote	Medium	Not required	None	Partial	None	Mozilla Firefox 3.0.x before 3.0.18, 3.5.x before 3.5.8, and 3.6.x before 3.6.2; Thunderbird before 3.0.2; and SeaMonkey before 2.0.3 allow remote attackers to perform cross-origin keystroke capture, and possibly conduct cross-site scripting (XSS) attacks, by using the addEventListener and setTimeout functions in conjunction with a wrapped object. NOTE: this vulnerability exists because of an incomplete fix for CVE-2007-3736.
924	CVE-2010-0170	79		XSS Bypass	2010-03-25	2017-09-18	4.3	None	Remote	Medium	Not required	None	Partial	None	Mozilla Firefox 3.6 before 3.6.2 does not offer plugins the expected window.location protection mechanism, which might allow remote attackers to bypass the Same Origin Policy and conduct cross-site scripting (XSS) attacks via vectors that are specific to each affected plugin.
925	CVE-2010-0169				2010-03-25	2017-09-18	5.0	None	Remote	Low	Not required	None	Partial	None	The CSSLoaderImpl::DoSheetComplete function in layout/style/nsCSSLoader.cpp in Mozilla Firefox 3.0.x before 3.0.18, 3.5.x before 3.5.8, and 3.6.x before 3.6.2; Thunderbird before 3.0.2; and SeaMonkey before 2.0.3 changes the case of certain strings in a stylesheet before adding this stylesheet to the XUL cache, which might allow remote attackers to modify the browser's font and other CSS attributes, and potentially disrupt rendering of a web page, by forcing the browser to perform this erroneous stylesheet caching.
926	CVE-2010-0168	264		DoS Exec Code	2010-03-25	2017-09-18	7.6	None	Remote	High	Not required	Complete	Complete	Complete	The nsDocument::MaybePreLoadImage function in content/base/src/nsDocument.cpp in the image-preloading implementation in Mozilla Firefox 3.6 before 3.6.2 does not apply scheme restrictions and policy restrictions to the image's URL, which might allow remote attackers to cause a denial of service (application crash or hang) or hijack the functionality of the browser's add-ons via a crafted SRC attribute of an IMG element, as demonstrated by remote command execution through an ssh: URL in a configuration that supports gnome-vfs with a nonstandard network.gnomevfs.supported-protocols setting.
927	CVE-2010-0167	119		DoS Exec Code Overflow Mem. Corr.	2010-03-25	2017-09-18	9.3	None	Remote	Medium	Not required	Complete	Complete	Complete	The browser engine in Mozilla Firefox 3.0.x before 3.0.18, 3.5.x before 3.5.8, and 3.6.x before 3.6.2; Thunderbird before 3.0.2; and SeaMonkey before 2.0.3 allows remote attackers to cause a denial of service (memory corruption and application crash) and possibly execute arbitrary code via vectors related to (1) layout/generic/nsBlockFrame.cpp and (2) the _evaluate function in modules/plugin/base/src/nsNPAPIPlugin.cpp.
928	CVE-2010-0166	119		DoS Exec Code Overflow Mem. Corr.	2010-03-25	2017-09-18	5.1	None	Remote	High	Not required	Partial	Partial	Partial	The gfxTextRun::SanitizeGlyphRuns function in gfx/thebes/src/gfxFont.cpp in the browser engine in Mozilla Firefox 3.6 before 3.6.2 on Mac OS X, when the Core Text API is used, does not properly perform certain deletions, which allows remote attackers to cause a denial of service (memory corruption and application crash) and possibly execute arbitrary code via an HTML document containing invisible Unicode characters, as demonstrated by the U+FEFF, U+FFF9, U+FFFA, and U+FFFB characters.
929	CVE-2010-0165	119		DoS Exec Code Overflow Mem. Corr.	2010-03-25	2017-09-18	9.3	None	Remote	Medium	Not required	Complete	Complete	Complete	The TraceRecorder::traverseScopeChain function in js/src/jstracer.cpp in the browser engine in Mozilla Firefox 3.6 before 3.6.2 allows remote attackers to cause a denial of service (memory corruption and application crash) and possibly execute arbitrary code via vectors involving certain indirect calls to the JavaScript eval function.
930	CVE-2010-0164	399		DoS Exec Code Mem. Corr.	2010-03-25	2017-09-18	9.3	None	Remote	Medium	Not required	Complete	Complete	Complete	Use-after-free vulnerability in the imgContainer::InternalAddFrameHelper function in src/imgContainer.cpp in libpr0n in Mozilla Firefox 3.6 before 3.6.2 allows remote attackers to cause a denial of service (heap memory corruption and application crash) or possibly execute arbitrary code via a multipart/x-mixed-replace animation in which the frames have different bits-per-pixel (bpp) values.
931	CVE-2010-0162	79		XSS Bypass	2010-02-22	2017-09-18	4.3	None	Remote	Medium	Not required	None	Partial	None	Mozilla Firefox 3.0.x before 3.0.18 and 3.5.x before 3.5.8, and SeaMonkey before 2.0.3, does not properly support the application/octet-stream content type as a protection mechanism against execution of web script in certain circumstances involving SVG and the EMBED element, which allows remote attackers to bypass the Same Origin Policy and conduct cross-site scripting (XSS) attacks via an embedded SVG document.
932	CVE-2010-0160	399		DoS Exec Code Mem. Corr.	2010-02-22	2017-09-18	10.0	None	Remote	Low	Not required	Complete	Complete	Complete	The Web Worker functionality in Mozilla Firefox 3.0.x before 3.0.18 and 3.5.x before 3.5.8, and SeaMonkey before 2.0.3, does not properly handle array data types for posted messages, which allows remote attackers to cause a denial of service (heap memory corruption and application crash) or possibly execute arbitrary code via unspecified vectors.
933	CVE-2010-0159			DoS Exec Code Mem. Corr.	2010-02-22	2017-09-18	10.0	None	Remote	Low	Not required	Complete	Complete	Complete	The browser engine in Mozilla Firefox 3.0.x before 3.0.18 and 3.5.x before 3.5.8, Thunderbird before 3.0.2, and SeaMonkey before 2.0.3 allows remote attackers to cause a denial of service (memory corruption and application crash) or possibly execute arbitrary code via vectors related to the nsBlockFrame::StealFrame function in layout/generic/nsBlockFrame.cpp, and unspecified other vectors.
934	CVE-2009-5017	79		XSS Bypass	2010-11-12	2010-12-01	4.3	None	Remote	Medium	Not required	None	Partial	None	Mozilla Firefox before 3.6 Beta 3 does not properly handle overlong UTF-8 encoding, which makes it easier for remote attackers to bypass cross-site scripting (XSS) protection mechanisms via a crafted string, a different vulnerability than CVE-2010-1210.
935	CVE-2009-4630	200		+Info	2010-01-29	2010-01-31	5.0	None	Remote	Low	Not required	Partial	None	None	Mozilla Necko, as used in Firefox, SeaMonkey, and other applications, performs DNS prefetching of domain names contained in links within local HTML documents, which makes it easier for remote attackers to determine the network location of the application's user by logging DNS requests. NOTE: the vendor disputes the significance of this issue, stating "I don't think we necessarily need to worry about that case."
936	CVE-2009-4130				2009-12-14	2017-08-16	5.8	None	Remote	Medium	Not required	None	Partial	Partial	Visual truncation vulnerability in the MakeScriptDialogTitle function in nsGlobalWindow.cpp in Mozilla Firefox allows remote attackers to spoof the origin domain name of a script via a long name.
937	CVE-2009-4129	362			2009-12-14	2017-08-16	5.8	None	Remote	Medium	Not required	None	Partial	Partial	Race condition in Mozilla Firefox allows remote attackers to produce a JavaScript message with a spoofed domain association by writing the message in between the document request and document load for a web page in a different domain.
938	CVE-2009-4102	20		Exec Code	2009-11-29	2017-08-16	9.3	None	Remote	Medium	Not required	Complete	Complete	Complete	Sage 1.4.3 and earlier extension for Firefox performs certain operations with chrome privileges, which allows remote attackers to execute arbitrary commands and perform cross-domain scripting attacks via the description tag of an RSS feed.
939	CVE-2009-3988	264		XSS Bypass	2010-02-22	2017-09-18	5.0	None	Remote	Low	Not required	Partial	None	None	Mozilla Firefox 3.0.x before 3.0.18 and 3.5.x before 3.5.8, and SeaMonkey before 2.0.3, does not properly restrict read access to object properties in showModalDialog, which allows remote attackers to bypass the Same Origin Policy and conduct cross-site scripting (XSS) attacks via crafted dialogArguments values.
940	CVE-2009-3987	200		+Info	2009-12-17	2017-09-18	7.8	None	Remote	Low	Not required	Complete	None	None	The GeckoActiveXObject function in Mozilla Firefox before 3.0.16 and 3.5.x before 3.5.6, and SeaMonkey before 2.0.1, generates different exception messages depending on whether the referenced COM object is listed in the registry, which allows remote attackers to obtain potentially sensitive information about installed software by making multiple calls that specify the ProgID values of different COM objects.
941	CVE-2009-3986	94			2009-12-17	2017-09-18	7.6	None	Remote	High	Not required	Complete	Complete	Complete	Mozilla Firefox before 3.0.16 and 3.5.x before 3.5.6, and SeaMonkey before 2.0.1, allows remote attackers to execute arbitrary JavaScript with chrome privileges by leveraging a reference to a chrome window from a content window, related to the window.opener property.
942	CVE-2009-3985				2009-12-17	2017-09-18	6.8	None	Remote	Medium	Not required	Partial	Partial	Partial	Mozilla Firefox before 3.0.16 and 3.5.x before 3.5.6, and SeaMonkey before 2.0.1, allows remote attackers to associate spoofed content with an invalid URL by setting document.location to this URL, and then writing arbitrary web script or HTML to the associated blank document, a related issue to CVE-2009-2654.
943	CVE-2009-3984				2009-12-17	2017-09-18	6.8	None	Remote	Medium	Not required	Partial	Partial	Partial	Mozilla Firefox before 3.0.16 and 3.5.x before 3.5.6, and SeaMonkey before 2.0.1, allows remote attackers to spoof an SSL indicator for an http URL or a file URL by setting document.location to an https URL corresponding to a site that responds with a No Content (aka 204) status code and an empty body.
944	CVE-2009-3983				2009-12-17	2017-09-18	6.8	None	Remote	Medium	Not required	Partial	Partial	Partial	Mozilla Firefox before 3.0.16 and 3.5.x before 3.5.6, and SeaMonkey before 2.0.1, allows remote attackers to send authenticated requests to arbitrary applications by replaying the NTLM credentials of a browser user.
945	CVE-2009-3982			DoS Exec Code Mem. Corr.	2009-12-17	2017-09-18	9.3	None	Remote	Medium	Not required	Complete	Complete	Complete	Multiple unspecified vulnerabilities in the JavaScript engine in Mozilla Firefox 3.5.x before 3.5.6, SeaMonkey before 2.0.1, and Thunderbird allow remote attackers to cause a denial of service (memory corruption and application crash) or possibly execute arbitrary code via unknown vectors.
946	CVE-2009-3981			DoS Exec Code Mem. Corr.	2009-12-17	2017-09-18	9.3	None	Remote	Medium	Not required	Complete	Complete	Complete	Unspecified vulnerability in the browser engine in Mozilla Firefox before 3.0.16, SeaMonkey before 2.0.1, and Thunderbird allows remote attackers to cause a denial of service (memory corruption and application crash) or possibly execute arbitrary code via unknown vectors.
947	CVE-2009-3980	399		DoS Exec Code Mem. Corr.	2009-12-17	2017-09-18	9.3	None	Remote	Medium	Not required	Complete	Complete	Complete	Multiple unspecified vulnerabilities in the browser engine in Mozilla Firefox 3.5.x before 3.5.6, SeaMonkey before 2.0.1, and Thunderbird allow remote attackers to cause a denial of service (memory corruption and application crash) or possibly execute arbitrary code via unknown vectors.
948	CVE-2009-3979			DoS Exec Code Mem. Corr.	2009-12-17	2017-09-18	9.3	None	Remote	Medium	Not required	Complete	Complete	Complete	Multiple unspecified vulnerabilities in the browser engine in Mozilla Firefox before 3.0.16 and 3.5.x before 3.5.6, SeaMonkey before 2.0.1, and Thunderbird allow remote attackers to cause a denial of service (memory corruption and application crash) or possibly execute arbitrary code via unknown vectors.
949	CVE-2009-3978			DoS	2009-11-18	2009-11-19	4.3	None	Remote	Medium	Not required	None	None	Partial	The nsGIFDecoder2::GifWrite function in decoders/gif/nsGIFDecoder2.cpp in libpr0n in Mozilla Firefox before 3.5.5 allows remote attackers to cause a denial of service (NULL pointer dereference and application crash) via an animated GIF file with a large image size, a different vulnerability than CVE-2009-3373.
950	CVE-2009-3389	189		DoS Exec Code Overflow	2009-12-17	2017-09-18	9.3	None	Remote	Medium	Not required	Complete	Complete	Complete	Integer overflow in libtheora in Xiph.Org Theora before 1.1, as used in Mozilla Firefox 3.5 before 3.5.6 and SeaMonkey before 2.0.1, allows remote attackers to cause a denial of service (application crash) or possibly execute arbitrary code via a video with large dimensions.
