#	CVE ID	CWE ID	# of Exploits	Vulnerability Type(s)	Publish Date	Update Date	Score	Gained Access Level	Access	Complexity	Authentication	Conf.	Integ.	Avail.
851	CVE-2010-3180	399		Exec Code	2010-10-21	2017-09-18	9.3	None	Remote	Medium	Not required	Complete	Complete	Complete	Use-after-free vulnerability in the nsBarProp function in Mozilla Firefox before 3.5.14 and 3.6.x before 3.6.11, Thunderbird before 3.0.9 and 3.1.x before 3.1.5, and SeaMonkey before 2.0.9 allows remote attackers to execute arbitrary code by accessing the locationbar property of a closed window.
852	CVE-2010-3179	119		DoS Exec Code Overflow Mem. Corr.	2010-10-21	2017-09-18	9.3	None	Remote	Medium	Not required	Complete	Complete	Complete	Stack-based buffer overflow in the text-rendering functionality in Mozilla Firefox before 3.5.14 and 3.6.x before 3.6.11, Thunderbird before 3.0.9 and 3.1.x before 3.1.5, and SeaMonkey before 2.0.9 allows remote attackers to execute arbitrary code or cause a denial of service (memory corruption and application crash) via a long argument to the document.write method.
853	CVE-2010-3178	264		Bypass	2010-10-21	2017-09-18	5.8	None	Remote	Medium	Not required	Partial	Partial	None	Mozilla Firefox before 3.5.14 and 3.6.x before 3.6.11, Thunderbird before 3.0.9 and 3.1.x before 3.1.5, and SeaMonkey before 2.0.9 do not properly handle certain modal calls made by javascript: URLs in circumstances related to opening a new window and performing cross-domain navigation, which allows remote attackers to bypass the Same Origin Policy via a crafted HTML document.
854	CVE-2010-3177	79		XSS	2010-10-21	2017-09-18	4.3	None	Remote	Medium	Not required	None	Partial	None	Multiple cross-site scripting (XSS) vulnerabilities in the Gopher parser in Mozilla Firefox before 3.5.14 and 3.6.x before 3.6.11, and SeaMonkey before 2.0.9, allow remote attackers to inject arbitrary web script or HTML via a crafted name of a (1) file or (2) directory on a Gopher server.
855	CVE-2010-3176			DoS Exec Code Mem. Corr.	2010-10-21	2017-09-18	9.3	None	Remote	Medium	Not required	Complete	Complete	Complete	Multiple unspecified vulnerabilities in the browser engine in Mozilla Firefox 3.5.x before 3.5.14 and 3.6.x before 3.6.11, Thunderbird before 3.0.9 and 3.1.x before 3.1.5, and SeaMonkey before 2.0.9 allow remote attackers to cause a denial of service (memory corruption and application crash) or possibly execute arbitrary code via unknown vectors.
856	CVE-2010-3175			DoS Exec Code Mem. Corr.	2010-10-21	2017-09-18	9.3	None	Remote	Medium	Not required	Complete	Complete	Complete	Multiple unspecified vulnerabilities in the browser engine in Mozilla Firefox 3.6.x before 3.6.11 and Thunderbird 3.1.x before 3.1.5 allow remote attackers to cause a denial of service (memory corruption and application crash) or possibly execute arbitrary code via unknown vectors.
857	CVE-2010-3174			DoS Exec Code Mem. Corr.	2010-10-21	2017-09-18	9.3	None	Remote	Medium	Not required	Complete	Complete	Complete	Unspecified vulnerability in the browser engine in Mozilla Firefox 3.5.x before 3.5.14, Thunderbird before 3.0.9, and SeaMonkey before 2.0.9 allows remote attackers to cause a denial of service (memory corruption and application crash) or possibly execute arbitrary code via unknown vectors.
858	CVE-2010-3173	310			2010-10-21	2017-09-18	7.5	None	Remote	Low	Not required	Partial	Partial	Partial	The SSL implementation in Mozilla Firefox before 3.5.14 and 3.6.x before 3.6.11, Thunderbird before 3.0.9 and 3.1.x before 3.1.5, and SeaMonkey before 2.0.9 does not properly set the minimum key length for Diffie-Hellman Ephemeral (DHE) mode, which makes it easier for remote attackers to defeat cryptographic protection mechanisms via a brute-force attack.
859	CVE-2010-3171	310			2010-09-15	2017-09-18	5.8	None	Remote	Medium	Not required	Partial	Partial	None	The Math.random function in the JavaScript implementation in Mozilla Firefox 3.5.10 through 3.5.11, 3.6.4 through 3.6.8, and 4.0 Beta1 uses a random number generator that is seeded only once per document object, which makes it easier for remote attackers to track a user, or trick a user into acting upon a spoofed pop-up message, by calculating the seed value, related to a "temporary footprint" and an "in-session phishing attack." NOTE: this vulnerability exists because of an incorrect fix for CVE-2008-5913.
860	CVE-2010-3170	310			2010-10-21	2017-09-18	4.3	None	Remote	Medium	Not required	None	Partial	None	Mozilla Firefox before 3.5.14 and 3.6.x before 3.6.11, Thunderbird before 3.0.9 and 3.1.x before 3.1.5, and SeaMonkey before 2.0.9 recognize a wildcard IP address in the subject's Common Name field of an X.509 certificate, which might allow man-in-the-middle attackers to spoof arbitrary SSL servers via a crafted certificate issued by a legitimate Certification Authority.
861	CVE-2010-3169			DoS Exec Code Mem. Corr.	2010-09-09	2017-09-18	9.3	None	Remote	Medium	Not required	Complete	Complete	Complete	Multiple unspecified vulnerabilities in the browser engine in Mozilla Firefox before 3.5.12 and 3.6.x before 3.6.9, Thunderbird before 3.0.7 and 3.1.x before 3.1.3, and SeaMonkey before 2.0.7 allow remote attackers to cause a denial of service (memory corruption and application crash) or possibly execute arbitrary code via unknown vectors.
862	CVE-2010-3168	119		DoS Exec Code Overflow	2010-09-09	2017-09-18	9.3	None	Remote	Medium	Not required	Complete	Complete	Complete	Mozilla Firefox before 3.5.12 and 3.6.x before 3.6.9, Thunderbird before 3.0.7 and 3.1.x before 3.1.3, and SeaMonkey before 2.0.7 do not properly restrict the role of property changes in triggering XUL tree removal, which allows remote attackers to cause a denial of service (deleted memory access and application crash) or possibly execute arbitrary code by setting unspecified properties.
863	CVE-2010-3167	119		Exec Code Overflow	2010-09-09	2017-09-18	9.3	None	Remote	Medium	Not required	Complete	Complete	Complete	The nsTreeContentView function in Mozilla Firefox before 3.5.12 and 3.6.x before 3.6.9, Thunderbird before 3.0.7 and 3.1.x before 3.1.3, and SeaMonkey before 2.0.7 does not properly handle node removal in XUL trees, which allows remote attackers to execute arbitrary code via vectors involving access to deleted memory, related to a "dangling pointer vulnerability."
864	CVE-2010-3166	119		Exec Code Overflow	2010-09-09	2017-09-18	9.3	None	Remote	Medium	Not required	Complete	Complete	Complete	Heap-based buffer overflow in the nsTextFrameUtils::TransformText function in Mozilla Firefox before 3.5.12 and 3.6.x before 3.6.9, Thunderbird before 3.0.7 and 3.1.x before 3.1.3, and SeaMonkey before 2.0.7 might allow remote attackers to execute arbitrary code via a bidirectional text run.
865	CVE-2010-3131		2	Exec Code	2010-08-26	2017-09-18	9.3	None	Remote	Medium	Not required	Complete	Complete	Complete	Untrusted search path vulnerability in Mozilla Firefox before 3.5.12 and 3.6.x before 3.6.9, Thunderbird before 3.0.7 and 3.1.x before 3.1.3, and SeaMonkey before 2.0.7 on Windows XP allows local users, and possibly remote attackers, to execute arbitrary code and conduct DLL hijacking attacks via a Trojan horse dwmapi.dll that is located in the same folder as a .htm, .html, .jtx, .mfp, or .eml file.
866	CVE-2010-2770	119		DoS Exec Code Overflow Mem. Corr.	2010-09-09	2017-09-18	9.3	None	Remote	Medium	Not required	Complete	Complete	Complete	Mozilla Firefox before 3.5.12 and 3.6.x before 3.6.9, Thunderbird before 3.0.7 and 3.1.x before 3.1.3, and SeaMonkey before 2.0.7 on Mac OS X allow remote attackers to cause a denial of service (memory corruption and application crash) or possibly execute arbitrary code via a crafted font in a data: URL.
867	CVE-2010-2769	79		XSS	2010-09-09	2017-09-18	4.3	None	Remote	Medium	Not required	None	Partial	None	Cross-site scripting (XSS) vulnerability in Mozilla Firefox before 3.5.12 and 3.6.x before 3.6.9, Thunderbird before 3.0.7 and 3.1.x before 3.1.3, and SeaMonkey before 2.0.7 allows user-assisted remote attackers to inject arbitrary web script or HTML via a selection that is added to a document in which the designMode property is enabled.
868	CVE-2010-2768	79		XSS Bypass	2010-09-09	2017-09-18	4.3	None	Remote	Medium	Not required	None	Partial	None	Mozilla Firefox before 3.5.12 and 3.6.x before 3.6.9, Thunderbird before 3.0.7 and 3.1.x before 3.1.3, and SeaMonkey before 2.0.7 do not properly restrict use of the type attribute of an OBJECT element to set a document's charset, which allows remote attackers to bypass cross-site scripting (XSS) protection mechanisms via UTF-7 encoding.
869	CVE-2010-2767	399		DoS Exec Code	2010-09-09	2017-09-18	9.3	None	Remote	Medium	Not required	Complete	Complete	Complete	The navigator.plugins implementation in Mozilla Firefox before 3.5.12 and 3.6.x before 3.6.9, Thunderbird before 3.0.7 and 3.1.x before 3.1.3, and SeaMonkey before 2.0.7 does not properly handle destruction of the DOM plugin array, which might allow remote attackers to cause a denial of service (application crash) or execute arbitrary code via crafted access to the navigator object, related to a "dangling pointer vulnerability."
870	CVE-2010-2766	94		Exec Code	2010-09-09	2017-09-18	9.3	None	Remote	Medium	Not required	Complete	Complete	Complete	The normalizeDocument function in Mozilla Firefox before 3.5.12 and 3.6.x before 3.6.9, Thunderbird before 3.0.7 and 3.1.x before 3.1.3, and SeaMonkey before 2.0.7 does not properly handle the removal of DOM nodes during normalization, which might allow remote attackers to execute arbitrary code via vectors involving access to a deleted object.
871	CVE-2010-2765	189		Exec Code Overflow	2010-09-09	2017-09-18	9.3	None	Remote	Medium	Not required	Complete	Complete	Complete	Integer overflow in the FRAMESET element implementation in Mozilla Firefox before 3.5.12 and 3.6.x before 3.6.9, Thunderbird before 3.0.7 and 3.1.x before 3.1.3, and SeaMonkey before 2.0.7 might allow remote attackers to execute arbitrary code via a large number of values in the cols (aka columns) attribute, leading to a heap-based buffer overflow.
872	CVE-2010-2764	264			2010-09-09	2017-09-18	4.3	None	Remote	Medium	Not required	Partial	None	None	Mozilla Firefox before 3.5.12 and 3.6.x before 3.6.9, Thunderbird before 3.0.7 and 3.1.x before 3.1.3, and SeaMonkey before 2.0.7 do not properly restrict read access to the statusText property of XMLHttpRequest objects, which allows remote attackers to discover the existence of intranet web servers via cross-origin requests.
873	CVE-2010-2763	79		XSS Bypass	2010-09-09	2017-09-18	4.3	None	Remote	Medium	Not required	None	Partial	None	The XPCSafeJSObjectWrapper class in the SafeJSObjectWrapper (aka SJOW) implementation in Mozilla Firefox before 3.5.12, Thunderbird before 3.0.7, and SeaMonkey before 2.0.7 does not properly restrict scripted functions, which allows remote attackers to bypass the Same Origin Policy and conduct cross-site scripting (XSS) attacks via a crafted function.
874	CVE-2010-2762	264		Exec Code	2010-09-09	2017-09-18	6.8	None	Remote	Medium	Not required	Partial	Partial	Partial	The XPCSafeJSObjectWrapper class in the SafeJSObjectWrapper (aka SJOW) implementation in Mozilla Firefox 3.6.x before 3.6.9 and Thunderbird 3.1.x before 3.1.3 does not properly restrict objects at the end of scope chains, which allows remote attackers to execute arbitrary JavaScript code with chrome privileges via vectors related to a chrome privileged object and a chain ending in an outer object.
875	CVE-2010-2760	399		Exec Code	2010-09-09	2017-09-18	9.3	None	Remote	Medium	Not required	Complete	Complete	Complete	Use-after-free vulnerability in the nsTreeSelection function in Mozilla Firefox before 3.5.12 and 3.6.x before 3.6.9, Thunderbird before 3.0.7 and 3.1.x before 3.1.3, and SeaMonkey before 2.0.7 might allow remote attackers to execute arbitrary code via vectors involving a XUL tree selection, related to a "dangling pointer vulnerability." NOTE: this issue exists because of an incomplete fix for CVE-2010-2753.
876	CVE-2010-2755	399		DoS Exec Code Mem. Corr.	2010-07-30	2017-09-18	10.0	None	Remote	Low	Not required	Complete	Complete	Complete	layout/generic/nsObjectFrame.cpp in Mozilla Firefox 3.6.7 does not properly free memory in the parameter array of a plugin instance, which allows remote attackers to cause a denial of service (memory corruption) or possibly execute arbitrary code via a crafted HTML document, related to the DATA and SRC attributes of an OBJECT element. NOTE: this vulnerability exists because of an incorrect fix for CVE-2010-1214.
877	CVE-2010-2754	200		+Info	2010-07-30	2017-09-18	5.0	None	Remote	Low	Not required	Partial	None	None	dom/base/nsJSEnvironment.cpp in Mozilla Firefox 3.5.x before 3.5.11 and 3.6.x before 3.6.7, Thunderbird 3.0.x before 3.0.6 and 3.1.x before 3.1.1, and SeaMonkey before 2.0.6 does not properly suppress a script's URL in certain circumstances involving a redirect and an error message, which allows remote attackers to obtain sensitive information about script parameters via a crafted HTML document, related to the window.onerror handler.
878	CVE-2010-2753	189		Exec Code Overflow	2010-07-30	2017-09-18	9.3	None	Remote	Medium	Not required	Complete	Complete	Complete	Integer overflow in Mozilla Firefox 3.5.x before 3.5.11 and 3.6.x before 3.6.7, Thunderbird 3.0.x before 3.0.6 and 3.1.x before 3.1.1, and SeaMonkey before 2.0.6 allows remote attackers to execute arbitrary code via a large selection attribute in a XUL tree element, which triggers a use-after-free.
879	CVE-2010-2752	189		Exec Code Overflow	2010-07-30	2017-09-18	9.3	None	Remote	Medium	Not required	Complete	Complete	Complete	Integer overflow in an array class in Mozilla Firefox 3.5.x before 3.5.11 and 3.6.x before 3.6.7, Thunderbird 3.0.x before 3.0.6 and 3.1.x before 3.1.1, and SeaMonkey before 2.0.6 allows remote attackers to execute arbitrary code by placing many Cascading Style Sheets (CSS) values in an array, related to references to external font resources and an inconsistency between 16-bit and 32-bit integers.
880	CVE-2010-2751	264			2010-07-30	2017-09-18	2.6	None	Remote	High	Not required	None	Partial	None	The nsDocShell::OnRedirectStateChange function in docshell/base/nsDocShell.cpp in Mozilla Firefox 3.5.x before 3.5.11 and 3.6.x before 3.6.7, and SeaMonkey before 2.0.6, allows remote attackers to spoof the SSL security status of a document via vectors involving multiple requests, a redirect, and the history.back and history.forward JavaScript functions.
881	CVE-2010-2117	399		DoS	2010-06-01	2017-09-18	4.3	None	Remote	Medium	Not required	None	None	Partial	Mozilla Firefox 3.0.19, 3.5.x, and 3.6.x allows remote attackers to cause a denial of service (resource consumption) via JavaScript code containing an infinite loop that creates IFRAME elements for invalid (1) news:// or (2) nntp:// URIs.
882	CVE-2010-1990	399		DoS	2010-05-20	2017-09-18	5.0	None	Remote	Low	Not required	None	None	Partial	Mozilla Firefox 3.6.x, 3.5.x, 3.0.19, and earlier, and SeaMonkey, executes a mail application in situations where an IFRAME element has a mailto: URL in its SRC attribute, which allows remote attackers to cause a denial of service (excessive application launches) via an HTML document with many IFRAME elements.
883	CVE-2010-1988		1	DoS Exec Code	2010-05-20	2017-09-18	10.0	None	Remote	Low	Not required	Complete	Complete	Complete	Mozilla Firefox 3.6.3 on Windows XP SP3 allows remote attackers to cause a denial of service (NULL pointer dereference and application crash) or possibly execute arbitrary code via JavaScript code that performs certain string concatenation and substring operations, a different vulnerability than CVE-2009-1571.
884	CVE-2010-1987	399	1	DoS	2010-05-20	2017-09-18	5.0	None	Remote	Low	Not required	None	None	Partial	Mozilla Firefox 3.6.3 on Windows XP SP3 allows remote attackers to cause a denial of service (memory consumption, out-of-bounds read, and application crash) via JavaScript code that appends long strings to the content of a P element, and performs certain other string concatenation and substring operations, related to the DoubleWideCharMappedString class in USP10.dll and the gfxWindowsFontGroup::GetUnderlineOffset function in xul.dll, a different vulnerability than CVE-2009-1571.
885	CVE-2010-1986	399	1	DoS	2010-05-20	2017-09-18	5.0	None	Remote	Low	Not required	None	None	Partial	Mozilla Firefox 3.6.3 on Windows XP SP3 allows remote attackers to cause a denial of service (memory consumption and application crash) via JavaScript code that creates multiple arrays containing elements with long string values, and then appends long strings to the content of a P element, related to the gfxWindowsFontGroup::MakeTextRun function in xul.dll, a different vulnerability than CVE-2009-1571.
886	CVE-2010-1585	20			2010-04-28	2017-09-18	9.3	None	Remote	Medium	Not required	Complete	Complete	Complete	The nsIScriptableUnescapeHTML.parseFragment method in the ParanoidFragmentSink protection mechanism in Mozilla Firefox before 3.5.17 and 3.6.x before 3.6.14, Thunderbird before 3.1.8, and SeaMonkey before 2.0.12 does not properly sanitize HTML in a chrome document, which makes it easier for remote attackers to execute arbitrary JavaScript with chrome privileges via a javascript: URI in input to an extension, as demonstrated by a javascript:alert sequence in (1) the HREF attribute of an A element or (2) the ACTION attribute of a FORM element.
887	CVE-2010-1215	94		Exec Code	2010-07-30	2017-09-18	6.8	None	Remote	Medium	Not required	Partial	Partial	Partial	Mozilla Firefox 3.6.x before 3.6.7 and Thunderbird 3.1.x before 3.1.1 do not properly implement access to a content object through a SafeJSObjectWrapper (aka SJOW) wrapper, which allows remote attackers to execute arbitrary JavaScript code with chrome privileges by leveraging "access to an object from the chrome scope."
888	CVE-2010-1214	189		Exec Code Overflow	2010-07-30	2017-09-18	9.3	None	Remote	Medium	Not required	Complete	Complete	Complete	Integer overflow in Mozilla Firefox 3.5.x before 3.5.11 and 3.6.x before 3.6.7, and SeaMonkey before 2.0.6, allows remote attackers to execute arbitrary code via plugin content with many parameter elements.
889	CVE-2010-1213	20		Bypass +Info	2010-07-30	2017-09-18	4.3	None	Remote	Medium	Not required	Partial	None	None	The importScripts Web Worker method in Mozilla Firefox 3.5.x before 3.5.11 and 3.6.x before 3.6.7, Thunderbird 3.0.x before 3.0.6 and 3.1.x before 3.1.1, and SeaMonkey before 2.0.6 does not verify that content is valid JavaScript code, which allows remote attackers to bypass the Same Origin Policy and obtain sensitive information via a crafted HTML document.
890	CVE-2010-1212	119		DoS Exec Code Overflow Mem. Corr.	2010-07-30	2017-09-18	9.3	None	Remote	Medium	Not required	Complete	Complete	Complete	js/src/jstracer.cpp in the browser engine in Mozilla Firefox 3.6.x before 3.6.7 and Thunderbird 3.1.x before 3.1.1 allows remote attackers to cause a denial of service (memory corruption and application crash) or possibly execute arbitrary code via vectors related to (1) propagation of deep aborts in the TraceRecorder::record_JSOP_BINDNAME function, (2) depth handling in the TraceRecorder::record_JSOP_GETELEM function, and (3) tracing of out-of-range arguments in the TraceRecorder::record_JSOP_ARGSUB function.
891	CVE-2010-1211			DoS Exec Code Mem. Corr.	2010-07-30	2017-09-18	9.3	None	Remote	Medium	Not required	Complete	Complete	Complete	Multiple unspecified vulnerabilities in the browser engine in Mozilla Firefox 3.5.x before 3.5.11 and 3.6.x before 3.6.7, Thunderbird 3.0.x before 3.0.6 and 3.1.x before 3.1.1, and SeaMonkey before 2.0.6 allow remote attackers to cause a denial of service (memory corruption and application crash) or possibly execute arbitrary code via unknown vectors.
892	CVE-2010-1210	20		XSS	2010-07-30	2017-09-18	4.3	None	Remote	Medium	Not required	None	Partial	None	intl/uconv/util/nsUnicodeDecodeHelper.cpp in Mozilla Firefox before 3.6.7 and Thunderbird before 3.1.1 inserts a U+FFFD sequence into text in certain circumstances involving undefined positions, which might make it easier for remote attackers to conduct cross-site scripting (XSS) attacks via crafted 8-bit text.
893	CVE-2010-1209	399		Exec Code	2010-07-30	2017-09-18	9.3	None	Remote	Medium	Not required	Complete	Complete	Complete	Use-after-free vulnerability in the NodeIterator implementation in Mozilla Firefox 3.5.x before 3.5.11 and 3.6.x before 3.6.7, and SeaMonkey before 2.0.6, allows remote attackers to execute arbitrary code via a crafted NodeFilter that detaches DOM nodes, related to the NodeIterator interface and a javascript callback.
894	CVE-2010-1208	399		Exec Code	2010-07-30	2017-09-18	9.3	None	Remote	Medium	Not required	Complete	Complete	Complete	Use-after-free vulnerability in the attribute-cloning functionality in the DOM implementation in Mozilla Firefox 3.5.x before 3.5.11 and 3.6.x before 3.6.7, and SeaMonkey before 2.0.6, allows remote attackers to execute arbitrary code via vectors related to deletion of an event attribute node with a nonzero reference count.
895	CVE-2010-1207	264		+Info	2010-07-30	2017-09-18	4.3	None	Remote	Medium	Not required	Partial	None	None	Mozilla Firefox before 3.6.7 and Thunderbird before 3.1.1 do not properly implement read restrictions for CANVAS elements, which allows remote attackers to obtain sensitive cross-origin information via vectors involving reference retention and node deletion.
896	CVE-2010-1206	264			2010-06-25	2017-09-18	4.3	None	Remote	Medium	Not required	None	Partial	None	The startDocumentLoad function in browser/base/content/browser.js in Mozilla Firefox 3.5.x before 3.5.11 and 3.6.x before 3.6.7, and SeaMonkey before 2.0.6, does not properly implement the Same Origin Policy in certain circumstances related to the about:blank document and a document that is currently loading, which allows (1) remote web servers to conduct spoofing attacks via vectors involving a 204 (aka No Content) status code, and allows (2) remote attackers to conduct spoofing attacks via vectors involving a window.stop call.
897	CVE-2010-1203			DoS Exec Code Mem. Corr.	2010-06-24	2017-09-18	9.3	None	Remote	Medium	Not required	Complete	Complete	Complete	The JavaScript engine in Mozilla Firefox 3.6.x before 3.6.4 allow remote attackers to cause a denial of service (memory corruption and application crash) or possibly execute arbitrary code via vectors that trigger an assertion failure in jstracer.cpp.
898	CVE-2010-1202			DoS Exec Code Mem. Corr.	2010-06-24	2017-09-18	9.3	None	Remote	Medium	Not required	Complete	Complete	Complete	Multiple unspecified vulnerabilities in the JavaScript engine in Mozilla Firefox 3.5.x before 3.5.10 and 3.6.x before 3.6.4, Thunderbird before 3.0.5, and SeaMonkey before 2.0.5 allow remote attackers to cause a denial of service (memory corruption and application crash) or possibly execute arbitrary code via unknown vectors.
899	CVE-2010-1201			DoS Exec Code Mem. Corr.	2010-06-24	2017-09-18	9.3	None	Remote	Medium	Not required	Complete	Complete	Complete	Unspecified vulnerability in the browser engine in Mozilla Firefox 3.5.x before 3.5.10, Thunderbird before 3.0.5, and SeaMonkey before 2.0.5 allows remote attackers to cause a denial of service (memory corruption and application crash) or possibly execute arbitrary code via unknown vectors.
900	CVE-2010-1200			DoS Exec Code Mem. Corr.	2010-06-24	2017-09-18	9.3	None	Remote	Medium	Not required	Complete	Complete	Complete	Multiple unspecified vulnerabilities in the browser engine in Mozilla Firefox 3.5.x before 3.5.10 and 3.6.x before 3.6.4, Thunderbird before 3.0.5, and SeaMonkey before 2.0.5 allow remote attackers to cause a denial of service (memory corruption and application crash) or possibly execute arbitrary code via unknown vectors.
