#	CVE ID	CWE ID	# of Exploits	Vulnerability Type(s)	Publish Date	Update Date	Score	Gained Access Level	Access	Complexity	Authentication	Conf.	Integ.	Avail.
301	CVE-2015-0798	264		Exec Code Bypass	2015-04-08	2016-12-07	5.0	None	Remote	Low	Not required	None	Partial	None	The Reader mode feature in Mozilla Firefox before 37.0.1 on Android, and Desktop Firefox pre-release, does not properly handle privileged URLs, which makes it easier for remote attackers to execute arbitrary JavaScript code with chrome privileges by leveraging the ability to bypass the Same Origin Policy.
302	CVE-2015-0797	119		DoS Exec Code Overflow	2015-05-14	2017-01-02	6.8	None	Remote	Medium	Not required	Partial	Partial	Partial	GStreamer before 1.4.5, as used in Mozilla Firefox before 38.0, Firefox ESR 31.x before 31.7, and Thunderbird before 31.7 on Linux, allows remote attackers to cause a denial of service (buffer over-read and application crash) or possibly execute arbitrary code via crafted H.264 video data in an m4v file.
303	CVE-2014-8643	264		Bypass	2015-01-14	2017-09-07	7.1	None	Remote	Medium	Not required	None	Complete	None	Mozilla Firefox before 35.0 on Windows allows remote attackers to bypass the Gecko Media Plugin (GMP) sandbox protection mechanism by leveraging access to the GMP process, as demonstrated by the OpenH264 plugin's process.
304	CVE-2014-8642	310		+Info	2015-01-14	2017-09-07	4.3	None	Remote	Medium	Not required	Partial	None	None	Mozilla Firefox before 35.0 and SeaMonkey before 2.32 do not consider the id-pkix-ocsp-nocheck extension in deciding whether to trust an OCSP responder, which makes it easier for remote attackers to obtain sensitive information by sniffing the network during a session in which there was an incorrect decision to accept a compromised and revoked certificate.
305	CVE-2014-8641			Exec Code	2015-01-14	2017-09-07	7.5	None	Remote	Low	Not required	Partial	Partial	Partial	Use-after-free vulnerability in the WebRTC implementation in Mozilla Firefox before 35.0, Firefox ESR 31.x before 31.4, and SeaMonkey before 2.32 allows remote attackers to execute arbitrary code via crafted track data.
306	CVE-2014-8640	362		DoS	2015-01-14	2017-09-07	5.0	None	Remote	Low	Not required	None	None	Partial	The mozilla::dom::AudioParamTimeline::AudioNodeInputValue function in the Web Audio API implementation in Mozilla Firefox before 35.0 and SeaMonkey before 2.32 does not properly restrict timeline operations, which allows remote attackers to cause a denial of service (uninitialized-memory read and application crash) via crafted API calls.
307	CVE-2014-8639				2015-01-14	2017-09-07	6.8	None	Remote	Medium	Not required	Partial	Partial	Partial	Mozilla Firefox before 35.0, Firefox ESR 31.x before 31.4, Thunderbird before 31.4, and SeaMonkey before 2.32 do not properly interpret Set-Cookie headers within responses that have a 407 (aka Proxy Authentication Required) status code, which allows remote HTTP proxy servers to conduct session fixation attacks by providing a cookie name that corresponds to the session cookie of the origin server.
308	CVE-2014-8638	352		Bypass CSRF	2015-01-14	2017-09-07	6.8	None	Remote	Medium	Not required	Partial	Partial	Partial	The navigator.sendBeacon implementation in Mozilla Firefox before 35.0, Firefox ESR 31.x before 31.4, Thunderbird before 31.4, and SeaMonkey before 2.32 omits the CORS Origin header, which allows remote attackers to bypass intended CORS access-control checks and conduct cross-site request forgery (CSRF) attacks via a crafted web site.
309	CVE-2014-8637	200		+Info	2015-01-14	2017-09-07	5.0	None	Remote	Low	Not required	Partial	None	None	Mozilla Firefox before 35.0 and SeaMonkey before 2.32 do not properly initialize memory for BMP images, which allows remote attackers to obtain sensitive information from process memory via a crafted web page that triggers the rendering of malformed BMP data within a CANVAS element.
310	CVE-2014-8636	94		Exec Code	2015-01-14	2017-09-07	7.5	None	Remote	Low	Not required	Partial	Partial	Partial	The XrayWrapper implementation in Mozilla Firefox before 35.0 and SeaMonkey before 2.32 does not properly interact with a DOM object that has a named getter, which might allow remote attackers to execute arbitrary JavaScript code with chrome privileges via unspecified vectors.
311	CVE-2014-8635			DoS Exec Code Mem. Corr.	2015-01-14	2017-01-02	7.5	None	Remote	Low	Not required	Partial	Partial	Partial	Multiple unspecified vulnerabilities in the browser engine in Mozilla Firefox before 35.0 and SeaMonkey before 2.32 allow remote attackers to cause a denial of service (memory corruption and application crash) or possibly execute arbitrary code via unknown vectors.
312	CVE-2014-8634			DoS Exec Code Mem. Corr.	2015-01-14	2017-09-07	7.5	None	Remote	Low	Not required	Partial	Partial	Partial	Multiple unspecified vulnerabilities in the browser engine in Mozilla Firefox before 35.0, Firefox ESR 31.x before 31.4, Thunderbird before 31.4, and SeaMonkey before 2.32 allow remote attackers to cause a denial of service (memory corruption and application crash) or possibly execute arbitrary code via unknown vectors.
313	CVE-2014-8632	284		Bypass	2014-12-11	2016-12-21	4.3	None	Remote	Medium	Not required	Partial	None	None	The structured-clone implementation in Mozilla Firefox before 34.0 and SeaMonkey before 2.31 does not properly interact with XrayWrapper property filtering, which allows remote attackers to bypass intended DOM object restrictions by leveraging property availability after XrayWrapper removal.
314	CVE-2014-8631	284		Bypass	2014-12-11	2016-12-21	4.3	None	Remote	Medium	Not required	Partial	None	None	The Chrome Object Wrapper (COW) implementation in Mozilla Firefox before 34.0 and SeaMonkey before 2.31 supports native-interface passing, which allows remote attackers to bypass intended DOM object restrictions via a call to an unspecified method.
315	CVE-2014-6492				2014-10-15	2015-03-17	7.6	None	Remote	High	Not required	Complete	Complete	Complete	Unspecified vulnerability in Oracle Java SE 6u81, 7u67, and 8u20, when running on Firefox, allows remote attackers to affect confidentiality, integrity, and availability via unknown vectors related to Deployment.
316	CVE-2014-1595	199		+Info	2014-12-11	2016-10-03	2.1	None	Local	Low	Not required	Partial	None	None	Mozilla Firefox before 34.0, Firefox ESR 31.x before 31.3, and Thunderbird before 31.3 on Apple OS X 10.10 omit a CoreGraphics disable-logging action that is needed by jemalloc-based applications, which allows local users to obtain sensitive information by reading /tmp files, as demonstrated by credential information.
317	CVE-2014-1594	20		Exec Code	2014-12-11	2016-12-23	6.8	None	Remote	Medium	Not required	Partial	Partial	Partial	Mozilla Firefox before 34.0, Firefox ESR 31.x before 31.3, Thunderbird before 31.3, and SeaMonkey before 2.31 might allow remote attackers to execute arbitrary code by leveraging an incorrect cast from the BasicThebesLayer data type to the BasicContainerLayer data type.
318	CVE-2014-1593	119		Exec Code Overflow	2014-12-11	2016-12-23	6.8	None	Remote	Medium	Not required	Partial	Partial	Partial	Stack-based buffer overflow in the mozilla::FileBlockCache::Read function in Mozilla Firefox before 34.0, Firefox ESR 31.x before 31.3, Thunderbird before 31.3, and SeaMonkey before 2.31 allows remote attackers to execute arbitrary code via crafted media content.
319	CVE-2014-1592			Exec Code	2014-12-11	2016-12-23	6.8	None	Remote	Medium	Not required	Partial	Partial	Partial	Use-after-free vulnerability in the nsHtml5TreeOperation function in xul.dll in Mozilla Firefox before 34.0, Firefox ESR 31.x before 31.3, Thunderbird before 31.3, and SeaMonkey before 2.31 allows remote attackers to execute arbitrary code by adding a second root element to an HTML5 document during parsing.
320	CVE-2014-1591	199		+Info	2014-12-11	2016-12-21	4.3	None	Remote	Medium	Not required	Partial	None	None	Mozilla Firefox 33.0 and SeaMonkey before 2.31 include path strings in CSP violation reports, which allows remote attackers to obtain sensitive information via a web site that receives a report after a redirect.
321	CVE-2014-1590	20		DoS	2014-12-11	2016-12-23	4.3	None	Remote	Medium	Not required	None	None	Partial	The XMLHttpRequest.prototype.send method in Mozilla Firefox before 34.0, Firefox ESR 31.x before 31.3, Thunderbird before 31.3, and SeaMonkey before 2.31 allows remote attackers to cause a denial of service (application crash) via a crafted JavaScript object.
322	CVE-2014-1589	284		Bypass	2014-12-11	2016-12-21	6.8	None	Remote	Medium	Not required	Partial	Partial	Partial	Mozilla Firefox before 34.0 and SeaMonkey before 2.31 provide stylesheets with an incorrect primary namespace, which allows remote attackers to bypass intended access restrictions via an XBL binding.
323	CVE-2014-1588			DoS Exec Code Mem. Corr.	2014-12-11	2016-12-21	6.8	None	Remote	Medium	Not required	Partial	Partial	Partial	Multiple unspecified vulnerabilities in the browser engine in Mozilla Firefox before 34.0 and SeaMonkey before 2.31 allow remote attackers to cause a denial of service (memory corruption and application crash) or possibly execute arbitrary code via unknown vectors.
324	CVE-2014-1587	20		DoS Exec Code Mem. Corr.	2014-12-11	2016-12-23	6.8	None	Remote	Medium	Not required	Partial	Partial	Partial	Multiple unspecified vulnerabilities in the browser engine in Mozilla Firefox before 34.0, Firefox ESR 31.x before 31.3, Thunderbird before 31.3, and SeaMonkey before 2.31 allow remote attackers to cause a denial of service (memory corruption and application crash) or possibly execute arbitrary code via unknown vectors.
325	CVE-2014-1586			+Info	2014-10-15	2016-12-23	5.0	None	Remote	Low	Not required	Partial	None	None	content/base/src/nsDocument.cpp in Mozilla Firefox before 33.0, Firefox ESR 31.x before 31.2, and Thunderbird 31.x before 31.2 does not consider whether WebRTC video sharing is occurring, which allows remote attackers to obtain sensitive information from the local camera in certain IFRAME situations by maintaining a session after the user temporarily navigates away.
326	CVE-2014-1585			+Info	2014-10-15	2016-12-23	5.0	None	Remote	Low	Not required	Partial	None	None	The WebRTC video-sharing feature in dom/media/MediaManager.cpp in Mozilla Firefox before 33.0, Firefox ESR 31.x before 31.2, and Thunderbird 31.x before 31.2 does not properly recognize Stop Sharing actions for videos in IFRAME elements, which allows remote attackers to obtain sensitive information from the local camera by maintaining a session after the user tries to discontinue streaming.
327	CVE-2014-1584	310		Bypass	2014-10-15	2016-12-21	4.3	None	Remote	Medium	Not required	None	Partial	None	The Public Key Pinning (PKP) implementation in Mozilla Firefox before 33.0 skips pinning checks upon an unspecified issuer-verification error, which makes it easier for remote attackers to bypass an intended pinning configuration and spoof a web site via a crafted certificate that leads to presentation of the Untrusted Connection dialog to the user.
328	CVE-2014-1583			Bypass	2014-10-15	2016-12-21	5.0	None	Remote	Low	Not required	Partial	None	None	The Alarm API in Mozilla Firefox before 33.0 and Firefox ESR 31.x before 31.2 does not properly restrict toJSON calls, which allows remote attackers to bypass the Same Origin Policy via crafted API calls that access sensitive information within the JSON data of an alarm.
329	CVE-2014-1582	310		Bypass	2014-10-15	2016-12-21	4.3	None	Remote	Medium	Not required	None	Partial	None	The Public Key Pinning (PKP) implementation in Mozilla Firefox before 33.0 does not properly consider the connection-coalescing behavior of SPDY and HTTP/2 in the case of a shared IP address, which allows man-in-the-middle attackers to bypass an intended pinning configuration and spoof a web site by providing a valid certificate from an arbitrary recognized Certification Authority.
330	CVE-2014-1581			Exec Code	2014-10-15	2016-12-23	7.5	None	Remote	Low	Not required	Partial	Partial	Partial	Use-after-free vulnerability in DirectionalityUtils.cpp in Mozilla Firefox before 33.0, Firefox ESR 31.x before 31.2, and Thunderbird 31.x before 31.2 allows remote attackers to execute arbitrary code via text that is improperly handled during the interaction between directionality resolution and layout.
331	CVE-2014-1580	200		+Info	2014-10-15	2016-12-21	5.0	None	Remote	Low	Not required	Partial	None	None	Mozilla Firefox before 33.0 does not properly initialize memory for GIF images, which allows remote attackers to obtain sensitive information from process memory via a crafted web page that triggers a sequence of rendering operations for truncated GIF data within a CANVAS element.
332	CVE-2014-1578	119		DoS Exec Code Overflow	2014-10-15	2016-12-23	7.5	None	Remote	Low	Not required	Partial	Partial	Partial	The get_tile function in Mozilla Firefox before 33.0, Firefox ESR 31.x before 31.2, and Thunderbird 31.x before 31.2 allows remote attackers to cause a denial of service (out-of-bounds write and application crash) or possibly execute arbitrary code via WebM frames with invalid tile sizes that are improperly handled in buffering operations during video playback.
333	CVE-2014-1577			DoS Mem. Corr. +Info	2014-10-15	2016-12-23	6.4	None	Remote	Low	Not required	Partial	None	Partial	The mozilla::dom::OscillatorNodeEngine::ComputeCustom function in the Web Audio subsystem in Mozilla Firefox before 33.0, Firefox ESR 31.x before 31.2, and Thunderbird 31.x before 31.2 allows remote attackers to obtain sensitive information from process memory or cause a denial of service (out-of-bounds read, memory corruption, and application crash) via an invalid custom waveform that triggers a calculation of a negative frequency value.
334	CVE-2014-1576	119		Exec Code Overflow	2014-10-15	2016-12-23	7.5	None	Remote	Low	Not required	Partial	Partial	Partial	Heap-based buffer overflow in the nsTransformedTextRun function in Mozilla Firefox before 33.0, Firefox ESR 31.x before 31.2, and Thunderbird 31.x before 31.2 allows remote attackers to execute arbitrary code via Cascading Style Sheets (CSS) token sequences that trigger changes to capitalization style.
335	CVE-2014-1575	264		DoS Exec Code Mem. Corr.	2014-10-15	2016-12-21	7.5	None	Remote	Low	Not required	Partial	Partial	Partial	Multiple unspecified vulnerabilities in the browser engine in Mozilla Firefox before 33.0 allow remote attackers to cause a denial of service (memory corruption and application crash) or possibly execute arbitrary code via vectors related to improper interaction between threading and garbage collection in the GCRuntime::triggerGC function in js/src/jsgc.cpp, and unknown other vectors.
336	CVE-2014-1574			DoS Exec Code Mem. Corr.	2014-10-15	2016-12-23	7.5	None	Remote	Low	Not required	Partial	Partial	Partial	Multiple unspecified vulnerabilities in the browser engine in Mozilla Firefox before 33.0, Firefox ESR 31.x before 31.2, and Thunderbird 31.x before 31.2 allow remote attackers to cause a denial of service (memory corruption and application crash) or possibly execute arbitrary code via unknown vectors.
337	CVE-2014-1568	310			2014-09-25	2017-08-28	7.5	None	Remote	Low	Not required	Partial	Partial	Partial	Mozilla Network Security Services (NSS) before 3.16.2.1, 3.16.x before 3.16.5, and 3.17.x before 3.17.1, as used in Mozilla Firefox before 32.0.3, Mozilla Firefox ESR 24.x before 24.8.1 and 31.x before 31.1.1, Mozilla Thunderbird before 24.8.1 and 31.x before 31.1.2, Mozilla SeaMonkey before 2.29.1, Google Chrome before 37.0.2062.124 on Windows and OS X, and Google Chrome OS before 37.0.2062.120, does not properly parse ASN.1 values in X.509 certificates, which makes it easier for remote attackers to spoof RSA signatures via a crafted certificate, aka a "signature malleability" issue.
338	CVE-2014-1567			Exec Code	2014-09-03	2017-01-06	9.3	None	Remote	Medium	Not required	Complete	Complete	Complete	Use-after-free vulnerability in DirectionalityUtils.cpp in Mozilla Firefox before 32.0, Firefox ESR 24.x before 24.8 and 31.x before 31.1, and Thunderbird 24.x before 24.8 and 31.x before 31.1 allows remote attackers to execute arbitrary code via text that is improperly handled during the interaction between directionality resolution and layout.
339	CVE-2014-1566	264		+Info	2014-09-03	2017-01-06	4.3	None	Remote	Medium	Not required	Partial	None	None	Mozilla Firefox before 31.1 on Android does not properly restrict copying of local files onto the SD card during processing of file: URLs, which allows attackers to obtain sensitive information from the Firefox profile directory via a crafted application. NOTE: this vulnerability exists because of an incomplete fix for CVE-2014-1515.
340	CVE-2014-1565	119		DoS Overflow +Info	2014-09-03	2017-01-06	5.0	None	Remote	Low	Not required	Partial	None	None	The mozilla::dom::AudioEventTimeline function in the Web Audio API implementation in Mozilla Firefox before 32.0, Firefox ESR 31.x before 31.1, and Thunderbird 31.x before 31.1 does not properly create audio timelines, which allows remote attackers to obtain sensitive information from process memory or cause a denial of service (out-of-bounds read) via crafted API calls.
341	CVE-2014-1564	824		+Info	2014-09-03	2017-01-06	4.3	None	Remote	Medium	Not required	Partial	None	None	Mozilla Firefox before 32.0, Firefox ESR 31.x before 31.1, and Thunderbird 31.x before 31.1 do not properly initialize memory for GIF rendering, which allows remote attackers to obtain sensitive information from process memory via crafted web script that interacts with a CANVAS element associated with a malformed GIF image.
342	CVE-2014-1563	416		DoS Exec Code Mem. Corr.	2014-09-03	2017-01-06	10.0	None	Remote	Low	Not required	Complete	Complete	Complete	Use-after-free vulnerability in the mozilla::DOMSVGLength::GetTearOff function in Mozilla Firefox before 32.0, Firefox ESR 31.x before 31.1, and Thunderbird 31.x before 31.1 allows remote attackers to execute arbitrary code or cause a denial of service (heap memory corruption) via an SVG animation with DOM interaction that triggers incorrect cycle collection.
343	CVE-2014-1562	119		DoS Exec Code Overflow Mem. Corr.	2014-09-03	2017-01-06	10.0	None	Remote	Low	Not required	Complete	Complete	Complete	Unspecified vulnerability in the browser engine in Mozilla Firefox before 32.0, Firefox ESR 24.x before 24.8 and 31.x before 31.1, and Thunderbird 24.x before 24.8 and 31.x before 31.1 allows remote attackers to cause a denial of service (memory corruption and application crash) or possibly execute arbitrary code via unknown vectors.
344	CVE-2014-1561	264			2014-07-23	2017-01-06	5.8	None	Remote	Medium	Not required	None	Partial	Partial	Mozilla Firefox before 31.0 does not properly restrict use of drag-and-drop events to spoof customization events, which allows remote attackers to alter the placement of UI icons via crafted JavaScript code that is encountered during (1) page, (2) panel, or (3) toolbar customization.
345	CVE-2014-1560			DoS	2014-07-23	2017-01-06	4.3	None	Remote	Medium	Not required	None	None	Partial	Mozilla Firefox before 31.0 and Thunderbird before 31.0 allow remote attackers to cause a denial of service (X.509 certificate parsing outage) via a crafted certificate that does not use ASCII character encoding in a required context.
346	CVE-2014-1559			DoS	2014-07-23	2017-01-06	4.3	None	Remote	Medium	Not required	None	None	Partial	Mozilla Firefox before 31.0 and Thunderbird before 31.0 allow remote attackers to cause a denial of service (X.509 certificate parsing outage) via a crafted certificate that does not use UTF-8 character encoding in a required context, a different vulnerability than CVE-2014-1558.
347	CVE-2014-1558			DoS	2014-07-23	2017-01-06	4.3	None	Remote	Medium	Not required	None	None	Partial	Mozilla Firefox before 31.0 and Thunderbird before 31.0 allow remote attackers to cause a denial of service (X.509 certificate parsing outage) via a crafted certificate that does not use UTF-8 character encoding in a required context, a different vulnerability than CVE-2014-1559.
348	CVE-2014-1557	94		Exec Code	2014-07-23	2017-01-06	9.3	None	Remote	Medium	Not required	Complete	Complete	Complete	The ConvolveHorizontally function in Skia, as used in Mozilla Firefox before 31.0, Firefox ESR 24.x before 24.7, and Thunderbird before 24.7, does not properly handle the discarding of image data during function execution, which allows remote attackers to execute arbitrary code by triggering prolonged image scaling, as demonstrated by scaling of a high-quality image.
349	CVE-2014-1556	94		Exec Code	2014-07-23	2017-01-06	9.3	None	Remote	Medium	Not required	Complete	Complete	Complete	Mozilla Firefox before 31.0, Firefox ESR 24.x before 24.7, and Thunderbird before 24.7 allow remote attackers to execute arbitrary code via crafted WebGL content constructed with the Cesium JavaScript library.
350	CVE-2014-1555			Exec Code	2014-07-23	2017-01-06	9.3	None	Remote	Medium	Not required	Complete	Complete	Complete	Use-after-free vulnerability in the nsDocLoader::OnProgress function in Mozilla Firefox before 31.0, Firefox ESR 24.x before 24.7, and Thunderbird before 24.7 allows remote attackers to execute arbitrary code via vectors that trigger a FireOnStateChange event.
